bill_id,session_id,bill_number,status,status_desc,status_date,title,description,committee_id,committee,last_action_date,last_action,url,state_link
1909445,2183,HB4001,2,Engrossed,2025-01-23,"Labor: hours and wages; minimum hourly wage rate; modify. Amends secs. 4 & 4b of 2014 PA 138 (MCL 408.414 & 408.414b) & repeals 2018 PA 337 (MCL 408.931 - 408.945). TIE BAR WITH: HB 4053'25","Labor: hours and wages; minimum hourly wage rate; modify. Amends secs. 4 & 4b of 2014 PA 138 (MCL 408.414 & 408.414b) & repeals 2018 PA 337 (MCL 408.931 - 408.945). TIE BAR WITH: HB 4053'25",4828,"Senate Regulatory Affairs",2025-02-04,"Referred To Committee On Regulatory Affairs",https://legiscan.com/MI/bill/HB4001/2025,https://legislature.mi.gov/Bills/Bill?ObjectName=2025-HB-4001
1909085,2183,HB4002,4,Passed,2025-02-25,"Labor: benefits; requirements for an employer to provide earned sick time, modify. Amends title and secs. 2, 3, 4, 5, 6, 7, 8 & 12 of 2018 PA 338 (MCL 408.962 et seq.) & adds sec. 3a.","Labor: benefits; requirements for an employer to provide earned sick time, modify. Amends title and secs. 2, 3, 4, 5, 6, 7, 8 & 12 of 2018 PA 338 (MCL 408.962 et seq.) & adds sec. 3a.",0,,2025-02-25,"Assigned Pa 2'25 With Immediate Effect",https://legiscan.com/MI/bill/HB4002/2025,https://legislature.mi.gov/Bills/Bill?ObjectName=2025-HB-4002
1917708,2183,HB4003,4,Passed,2025-08-19,"Highways: memorial; portion of US-131; designate as the ""Sgt. Matthew Webber Memorial Highway"". Amends 2001 PA 142 (MCL 250.1001 - 250.2092) by adding sec. 1073b.","Highways: memorial; portion of US-131; designate as the ""Sgt. Matthew Webber Memorial Highway"". Amends 2001 PA 142 (MCL 250.1001 - 250.2092) by adding sec. 1073b.",0,,2025-08-19,"Assigned Pa 7'25 With Immediate Effect",https://legiscan.com/MI/bill/HB4003/2025,https://legislature.mi.gov/Bills/Bill?ObjectName=2025-HB-4003
1918072,2183,HB4004,2,Engrossed,2025-03-20,"Gaming: lottery; multistate lottery games; allow winner to remain anonymous. Amends sec. 25 of 1972 PA 239 (MCL 432.25).","Gaming: lottery; multistate lottery games; allow winner to remain anonymous. Amends sec. 25 of 1972 PA 239 (MCL 432.25).",4828,"Senate Regulatory Affairs",2025-04-15,"Referred To Committee On Regulatory Affairs",https://legiscan.com/MI/bill/HB4004/2025,https://legislature.mi.gov/Bills/Bill?ObjectName=2025-HB-4004
1917656,2183,HB4005,1,Introduced,2025-01-14,"Local government: other; local financial stability and choice act; repeal. Repeals 2012 PA 436 (MCL 141.1541 - 141.1575).","Local government: other; local financial stability and choice act; repeal. Repeals 2012 PA 436 (MCL 141.1541 - 141.1575).",5003,"House Finance",2025-01-15,"Bill Electronically Reproduced 01/14/2025",https://legiscan.com/MI/bill/HB4005/2025,https://legislature.mi.gov/Bills/Bill?ObjectName=2025-HB-4005
1918428,2183,HB4006,1,Introduced,2025-01-14,"Agriculture: agribusiness; exclusion of commercial weddings or similar events in agricultural zones; prohibit. Amends 2006 PA 110 (MCL 125.3101 - 125.3702) by adding sec. 204b.","Agriculture: agribusiness; exclusion of commercial weddings or similar events in agricultural zones; prohibit. Amends 2006 PA 110 (MCL 125.3101 - 125.3702) by adding sec. 204b.",808,"House Agriculture",2025-01-15,"Bill Electronically Reproduced 01/14/2025",https://legiscan.com/MI/bill/HB4006/2025,https://legislature.mi.gov/Bills/Bill?ObjectName=2025-HB-4006
1918310,2183,HB4007,2,Engrossed,2025-05-07,"Energy: alternative sources; clean energy system; expand definition of. Amends sec. 3 of 2008 PA 295 (MCL 460.1003).","Energy: alternative sources; clean energy system; expand definition of. Amends sec. 3 of 2008 PA 295 (MCL 460.1003).",838,"Senate Government Operations",2025-05-13,"Referred To Committee On Government Operations",https://legiscan.com/MI/bill/HB4007/2025,https://legislature.mi.gov/Bills/Bill?ObjectName=2025-HB-4007
1918189,2183,HB4008,1,Introduced,2025-01-14,"Individual income tax: credit; qualified volunteers credit; create. Amends 1967 PA 281 (MCL 206.1 - 206.847) by adding sec. 281.","Individual income tax: credit; qualified volunteers credit; create. Amends 1967 PA 281 (MCL 206.1 - 206.847) by adding sec. 281.",5003,"House Finance",2025-01-15,"Bill Electronically Reproduced 01/14/2025",https://legiscan.com/MI/bill/HB4008/2025,https://legislature.mi.gov/Bills/Bill?ObjectName=2025-HB-4008
1917887,2183,HB4009,1,Introduced,2025-01-14,"Housing: affordable; rent control policies; allow local governments to establish. Repeals 1988 PA 226 (MCL 123.411).","Housing: affordable; rent control policies; allow local governments to establish. Repeals 1988 PA 226 (MCL 123.411).",899,"House Government Operations",2025-01-15,"Bill Electronically Reproduced 01/14/2025",https://legiscan.com/MI/bill/HB4009/2025,https://legislature.mi.gov/Bills/Bill?ObjectName=2025-HB-4009
1917826,2183,HB4010,2,Engrossed,2025-05-20,"State: symbol; Harrison Township; designate as Boat Town USA. Creates new act.","State: symbol; Harrison Township; designate as Boat Town USA. Creates new act.",838,"Senate Government Operations",2025-05-29,"Referred To Committee On Government Operations",https://legiscan.com/MI/bill/HB4010/2025,https://legislature.mi.gov/Bills/Bill?ObjectName=2025-HB-4010
1917766,2183,HB4011,2,Engrossed,2025-06-11,"Property: conveyance of state property; transfer of certain state-owned property in Arenac County; provide for. Creates land transfer act.","Property: conveyance of state property; transfer of certain state-owned property in Arenac County; provide for. Creates land transfer act.",3189,"Senate Local Government",2025-06-12,"Referred To Committee On Local Government",https://legiscan.com/MI/bill/HB4011/2025,https://legislature.mi.gov/Bills/Bill?ObjectName=2025-HB-4011
1918368,2183,HB4012,2,Engrossed,2025-09-09,"Health: emergency services; emergency medical transport and treatment for retired police canines; provide for. Amends sec. 20925 of 1978 PA 368 (MCL 333.20925).","Health: emergency services; emergency medical transport and treatment for retired police canines; provide for. Amends sec. 20925 of 1978 PA 368 (MCL 333.20925).",4863,"Senate Veterans And Emergency Services",2025-09-11,"Referred To Committee On Veterans And Emergency Services",https://legiscan.com/MI/bill/HB4012/2025,https://legislature.mi.gov/Bills/Bill?ObjectName=2025-HB-4012
1918007,2183,HB4013,2,Engrossed,2025-04-15,"Recreation: other; recreational trespass act; modify posting requirements. Amends sec. 73102 of 1994 PA 451 (MCL 324.73102).","Recreation: other; recreational trespass act; modify posting requirements. Amends sec. 73102 of 1994 PA 451 (MCL 324.73102).",4774,"Senate Natural Resources And Agriculture",2025-04-17,"Referred To Committee On Natural Resources And Agriculture",https://legiscan.com/MI/bill/HB4013/2025,https://legislature.mi.gov/Bills/Bill?ObjectName=2025-HB-4013
1918128,2183,HB4014,2,Engrossed,2025-03-18,"Property tax: assessments; transfer of ownership of certain real property to certain individuals; exempt from uncapping of taxable value upon transfer. Amends sec. 27a of 1893 PA 206 (MCL 211.27a).","Property tax: assessments; transfer of ownership of certain real property to certain individuals; exempt from uncapping of taxable value upon transfer. Amends sec. 27a of 1893 PA 206 (MCL 211.27a).",4717,"Senate Finance, Insurance, And Consumer Protection",2025-03-20,"Referred To Committee On Finance, Insurance, And Consumer Protection",https://legiscan.com/MI/bill/HB4014/2025,https://legislature.mi.gov/Bills/Bill?ObjectName=2025-HB-4014
1918247,2183,HB4015,1,Introduced,2025-01-14,"Highways: other; acceptance of cash payments for tolls; require. Creates new act.","Highways: other; acceptance of cash payments for tolls; require. Creates new act.",2834,"House Transportation And Infrastructure",2025-01-15,"Bill Electronically Reproduced 01/14/2025",https://legiscan.com/MI/bill/HB4015/2025,https://legislature.mi.gov/Bills/Bill?ObjectName=2025-HB-4015
1917948,2183,HB4016,1,Introduced,2025-01-14,"Holidays: other; ""Huntington's Disease Awareness Month""; designate as the month of May of each year. Creates new act.","Holidays: other; ""Huntington's Disease Awareness Month""; designate as the month of May of each year. Creates new act.",899,"House Government Operations",2025-01-15,"Bill Electronically Reproduced 01/14/2025",https://legiscan.com/MI/bill/HB4016/2025,https://legislature.mi.gov/Bills/Bill?ObjectName=2025-HB-4016
1919985,2183,HB4017,2,Engrossed,2025-09-03,"Labor: health and safety; penalty for failure to report a death; decrease by the maximum allowable amount if the death occurs to a certain individual on a family farm. Amends sec. 35 of 1974 PA 154 (MCL 408.1035).","Labor: health and safety; penalty for failure to report a death; decrease by the maximum allowable amount if the death occurs to a certain individual on a family farm. Amends sec. 35 of 1974 PA 154 (MCL 408.1035).",4719,"Senate Labor",2025-09-09,"Referred To Committee On Labor",https://legiscan.com/MI/bill/HB4017/2025,https://legislature.mi.gov/Bills/Bill?ObjectName=2025-HB-4017
1935066,2183,HB4018,2,Engrossed,2025-03-11,"Juveniles: crimes; transportation of juvenile who commits a crime with an adult; clarify. Amends sec. 16 of 1939 PA 288 (MCL 712A.16).","Juveniles: crimes; transportation of juvenile who commits a crime with an adult; clarify. Amends sec. 16 of 1939 PA 288 (MCL 712A.16).",4720,"Senate Civil Rights, Judiciary, And Public Safety",2025-03-13,"Referred To Committee On Civil Rights, Judiciary, And Public Safety",https://legiscan.com/MI/bill/HB4018/2025,https://legislature.mi.gov/Bills/Bill?ObjectName=2025-HB-4018
1934796,2183,HB4019,1,Introduced,2025-01-22,"Individual income tax: reporting; annual revenue report to individual income tax filers; require. Amends 1967 PA 281 (MCL 206.1 - 206.847) by adding sec. 471a.","Individual income tax: reporting; annual revenue report to individual income tax filers; require. Amends 1967 PA 281 (MCL 206.1 - 206.847) by adding sec. 471a.",5003,"House Finance",2025-01-23,"Bill Electronically Reproduced 01/22/2025",https://legiscan.com/MI/bill/HB4019/2025,https://legislature.mi.gov/Bills/Bill?ObjectName=2025-HB-4019
1934534,2183,HB4020,1,Introduced,2025-01-22,"Education: curriculum; requirement for schools to provide instruction on African-American history; provide for, and create the commission to update African-American history in K to 12 instruction. Amends 1976 PA 451 (MCL 380.1 - 380.1852) by adding sec. 1164.","Education: curriculum; requirement for schools to provide instruction on African-American history; provide for, and create the commission to update African-American history in K to 12 instruction. Amends 1976 PA 451 (MCL 380.1 - 380.1852) by adding sec. 1164.",5044,"House Education And Workforce",2025-01-23,"Bill Electronically Reproduced 01/22/2025",https://legiscan.com/MI/bill/HB4020/2025,https://legislature.mi.gov/Bills/Bill?ObjectName=2025-HB-4020
1944004,2183,HB4021,1,Introduced,2025-01-28,"Civil procedure: evictions; pretrial and trial; require pretrial, and allow trial and pretrial to be conducted by magistrate. Amends secs. 5735 & 8511 of 1961 PA 236 (MCL 600.5735 & 600.8511).","Civil procedure: evictions; pretrial and trial; require pretrial, and allow trial and pretrial to be conducted by magistrate. Amends secs. 5735 & 8511 of 1961 PA 236 (MCL 600.5735 & 600.8511).",5081,"House Rules",2025-03-18,"Referred To Committee On Rules",https://legiscan.com/MI/bill/HB4021/2025,https://legislature.mi.gov/Bills/Bill?ObjectName=2025-HB-4021
1944179,2183,HB4022,1,Introduced,2025-01-28,"Local government: other; educational instruction access act; repeal. Repeals 2017 PA 98 (MCL 123.1041 - 123.1047).","Local government: other; educational instruction access act; repeal. Repeals 2017 PA 98 (MCL 123.1041 - 123.1047).",5044,"House Education And Workforce",2025-01-29,"Bill Electronically Reproduced 01/28/2025",https://legiscan.com/MI/bill/HB4022/2025,https://legislature.mi.gov/Bills/Bill?ObjectName=2025-HB-4022
1944049,2183,HB4023,2,Engrossed,2025-06-05,"Property: conveyance of state property; transfer of certain state-owned property in Eaton County; provide for. Creates land transfer act.","Property: conveyance of state property; transfer of certain state-owned property in Eaton County; provide for. Creates land transfer act.",3189,"Senate Local Government",2025-06-10,"Referred To Committee On Local Government",https://legiscan.com/MI/bill/HB4023/2025,https://legislature.mi.gov/Bills/Bill?ObjectName=2025-HB-4023
1943962,2183,HB4024,2,Engrossed,2025-09-04,"Civil rights: privacy; restriction of student access to certain restrooms and changing areas based on biological sex; provide for. Creates new act.","Civil rights: privacy; restriction of student access to certain restrooms and changing areas based on biological sex; provide for. Creates new act.",838,"Senate Government Operations",2025-09-09,"Referred To Committee On Government Operations",https://legiscan.com/MI/bill/HB4024/2025,https://legislature.mi.gov/Bills/Bill?ObjectName=2025-HB-4024
1944518,2183,HB4025,2,Engrossed,2025-03-13,"Sales tax: exemptions; sunset date on exemption for firearm safety devices; extend. Amends sec. 4ll of 1933 PA 167 (MCL 205.54ll).","Sales tax: exemptions; sunset date on exemption for firearm safety devices; extend. Amends sec. 4ll of 1933 PA 167 (MCL 205.54ll).",4720,"Senate Civil Rights, Judiciary, And Public Safety",2025-03-18,"Referred To Committee On Civil Rights, Judiciary, And Public Safety",https://legiscan.com/MI/bill/HB4025/2025,https://legislature.mi.gov/Bills/Bill?ObjectName=2025-HB-4025
1944477,2183,HB4026,2,Engrossed,2025-03-13,"Use tax: exemptions; sunset date on exemption for firearm safety devices; extend. Amends sec. 4ll of 1937 PA 94 (MCL 205.94ll).","Use tax: exemptions; sunset date on exemption for firearm safety devices; extend. Amends sec. 4ll of 1937 PA 94 (MCL 205.94ll).",4720,"Senate Civil Rights, Judiciary, And Public Safety",2025-03-18,"Referred To Committee On Civil Rights, Judiciary, And Public Safety",https://legiscan.com/MI/bill/HB4026/2025,https://legislature.mi.gov/Bills/Bill?ObjectName=2025-HB-4026
1944392,2183,HB4027,2,Engrossed,2025-04-30,"Land use: zoning and growth management; provision subjecting zoning authority to part 8 of clean and renewable energy and energy waste reduction act; delete. Amends sec. 205 of 2006 PA 110 (MCL 125.3205). TIE BAR WITH: HB 4028'25","Land use: zoning and growth management; provision subjecting zoning authority to part 8 of clean and renewable energy and energy waste reduction act; delete. Amends sec. 205 of 2006 PA 110 (MCL 125.3205). TIE BAR WITH: HB 4028'25",838,"Senate Government Operations",2025-05-06,"Referred To Committee On Government Operations",https://legiscan.com/MI/bill/HB4027/2025,https://legislature.mi.gov/Bills/Bill?ObjectName=2025-HB-4027
1944307,2183,HB4028,2,Engrossed,2025-04-30,"Energy: alternative sources; zoning exemptions for large-scale solar, wind, and energy storage facilities; eliminate. Amends title & sec. 13 of 2008 PA 295 (MCL 460.1013) & repeals pt. 8 of 2008 PA 295 (MCL 460.1221 - 460.1232). TIE BAR WITH: HB 4027'25","Energy: alternative sources; zoning exemptions for large-scale solar, wind, and energy storage facilities; eliminate. Amends title & sec. 13 of 2008 PA 295 (MCL 460.1013) & repeals pt. 8 of 2008 PA 295 (MCL 460.1221 - 460.1232). TIE BAR WITH: HB 4027'25",838,"Senate Government Operations",2025-05-06,"Referred To Committee On Government Operations",https://legiscan.com/MI/bill/HB4028/2025,https://legislature.mi.gov/Bills/Bill?ObjectName=2025-HB-4028
1944349,2183,HB4029,2,Engrossed,2025-04-30,"Natural resources: hunting; posting of rules and regulations by a certain date; require. Amends secs. 40113a & 41103 of 1994 PA 451 (MCL 324.40113a & 324.41103).","Natural resources: hunting; posting of rules and regulations by a certain date; require. Amends secs. 40113a & 41103 of 1994 PA 451 (MCL 324.40113a & 324.41103).",838,"Senate Government Operations",2025-05-06,"Referred To Committee On Government Operations",https://legiscan.com/MI/bill/HB4029/2025,https://legislature.mi.gov/Bills/Bill?ObjectName=2025-HB-4029
1944435,2183,HB4030,1,Introduced,2025-01-28,"Labor: youth employment; parent or legal guardian of a minor being educated at the minor's home; allow to issue a work permit for the minor. Amends sec. 2 of 1978 PA 90 (MCL 409.102).","Labor: youth employment; parent or legal guardian of a minor being educated at the minor's home; allow to issue a work permit for the minor. Amends sec. 2 of 1978 PA 90 (MCL 409.102).",5044,"House Education And Workforce",2025-01-29,"Bill Electronically Reproduced 01/28/2025",https://legiscan.com/MI/bill/HB4030/2025,https://legislature.mi.gov/Bills/Bill?ObjectName=2025-HB-4030
1943877,2183,HB4031,1,Introduced,2025-01-28,"Recreation: athletics and sports; publicly funded individual sports programs that provide separate programs for males and females; require athletes to be scored according to their biological sex. Creates new act.","Recreation: athletics and sports; publicly funded individual sports programs that provide separate programs for males and females; require athletes to be scored according to their biological sex. Creates new act.",5044,"House Education And Workforce",2025-01-29,"Bill Electronically Reproduced 01/28/2025",https://legiscan.com/MI/bill/HB4031/2025,https://legislature.mi.gov/Bills/Bill?ObjectName=2025-HB-4031
1944091,2183,HB4032,2,Engrossed,2025-03-06,"Health occupations: physicians; interstate medical licensure compact; remove sunset. Amends sec. 16189 of 1978 PA 368 (MCL 333.16189).","Health occupations: physicians; interstate medical licensure compact; remove sunset. Amends sec. 16189 of 1978 PA 368 (MCL 333.16189).",839,"Senate Health Policy",2025-03-12,"Referred To Committee On Health Policy",https://legiscan.com/MI/bill/HB4032/2025,https://legislature.mi.gov/Bills/Bill?ObjectName=2025-HB-4032
1944552,2183,HB4033,2,Engrossed,2025-04-23,"Probate: trusts; procedures relating to the administration of unitrusts and income trusts; provide for. Creates new act.","Probate: trusts; procedures relating to the administration of unitrusts and income trusts; provide for. Creates new act.",4720,"Senate Civil Rights, Judiciary, And Public Safety",2025-04-29,"Referred To Committee On Civil Rights, Judiciary, And Public Safety",https://legiscan.com/MI/bill/HB4033/2025,https://legislature.mi.gov/Bills/Bill?ObjectName=2025-HB-4033
1944224,2183,HB4034,2,Engrossed,2025-04-23,"Probate: trusts; uniform statutory rule against perpetuities; revise to reflect limitation of the personal property trust perpetuities act to certain property. Amends secs. 3 & 5 of 1988 PA 418 (MCL 554.73 & 554.75). TIE BAR WITH: HB 4033'25","Probate: trusts; uniform statutory rule against perpetuities; revise to reflect limitation of the personal property trust perpetuities act to certain property. Amends secs. 3 & 5 of 1988 PA 418 (MCL 554.73 & 554.75). TIE BAR WITH: HB 4033'25",4720,"Senate Civil Rights, Judiciary, And Public Safety",2025-04-29,"Referred To Committee On Civil Rights, Judiciary, And Public Safety",https://legiscan.com/MI/bill/HB4034/2025,https://legislature.mi.gov/Bills/Bill?ObjectName=2025-HB-4034
1943920,2183,HB4035,1,Introduced,2025-01-28,"Environmental protection: sewage; violations for sewer overflows; modify. Amends 1994 PA 451 (MCL 324.101 - 324.90106) by adding sec. 3115b.","Environmental protection: sewage; violations for sewer overflows; modify. Amends 1994 PA 451 (MCL 324.101 - 324.90106) by adding sec. 3115b.",5004,"House Natural Resources And Tourism",2025-01-29,"Bill Electronically Reproduced 01/28/2025",https://legiscan.com/MI/bill/HB4035/2025,https://legislature.mi.gov/Bills/Bill?ObjectName=2025-HB-4035
1946006,2183,HB4036,1,Introduced,2025-01-29,"Higher education: education programs; authorization and distance education reciprocal exchange act; remove sunset. Repeals sec. 7 of 2015 PA 45 (MCL 390.1697).","Higher education: education programs; authorization and distance education reciprocal exchange act; remove sunset. Repeals sec. 7 of 2015 PA 45 (MCL 390.1697).",5044,"House Education And Workforce",2025-01-30,"Bill Electronically Reproduced 01/29/2025",https://legiscan.com/MI/bill/HB4036/2025,https://legislature.mi.gov/Bills/Bill?ObjectName=2025-HB-4036
1946420,2183,HB4037,1,Introduced,2025-01-29,"Records: health; health information exchange; establish certain requirements to operate a health data utility. Amends secs. 2501 & 2505 of 1978 PA 368 (MCL 333.2501 & 333.2505) & adds sec. 2508.","Records: health; health information exchange; establish certain requirements to operate a health data utility. Amends secs. 2501 & 2505 of 1978 PA 368 (MCL 333.2501 & 333.2505) & adds sec. 2508.",0,,2025-05-21,"Referred To Second Reading",https://legiscan.com/MI/bill/HB4037/2025,https://legislature.mi.gov/Bills/Bill?ObjectName=2025-HB-4037
1946058,2183,HB4038,1,Introduced,2025-01-29,"Insurance: other; allocation of revenue under the insurance provider assessment act; modify. Amends sec. 13 of 2018 PA 175 (MCL 550.1763). TIE BAR WITH: HB 4037'25","Insurance: other; allocation of revenue under the insurance provider assessment act; modify. Amends sec. 13 of 2018 PA 175 (MCL 550.1763). TIE BAR WITH: HB 4037'25",0,,2025-05-21,"Referred To Second Reading",https://legiscan.com/MI/bill/HB4038/2025,https://legislature.mi.gov/Bills/Bill?ObjectName=2025-HB-4038
1946235,2183,HB4039,1,Introduced,2025-01-29,"Administrative procedure: rules; requirement to eliminate regulations; provide for. Amends sec. 39 of 1969 PA 306 (MCL 24.239).","Administrative procedure: rules; requirement to eliminate regulations; provide for. Amends sec. 39 of 1969 PA 306 (MCL 24.239).",5081,"House Rules",2025-01-30,"Bill Electronically Reproduced 01/29/2025",https://legiscan.com/MI/bill/HB4039/2025,https://legislature.mi.gov/Bills/Bill?ObjectName=2025-HB-4039
1948756,2183,HB4040,1,Introduced,2025-01-30,"Labor: fair employment practices; certain noncompete agreements; prohibit employers from requiring employees to enter into unless certain conditions are met. Amends sec. 4a of 1984 PA 274 (MCL 445.774a).","Labor: fair employment practices; certain noncompete agreements; prohibit employers from requiring employees to enter into unless certain conditions are met. Amends sec. 4a of 1984 PA 274 (MCL 445.774a).",5089,"House Economic Competitiveness",2025-02-04,"Bill Electronically Reproduced 01/30/2025",https://legiscan.com/MI/bill/HB4040/2025,https://legislature.mi.gov/Bills/Bill?ObjectName=2025-HB-4040
1949037,2183,HB4041,1,Introduced,2025-01-30,"Property tax: exemptions; continuation of poverty exemption, without subsequent application, for homeowner who previously established eligibility; provide for in certain circumstances. Amends sec. 7u of 1893 PA 206 (MCL 211.7u).","Property tax: exemptions; continuation of poverty exemption, without subsequent application, for homeowner who previously established eligibility; provide for in certain circumstances. Amends sec. 7u of 1893 PA 206 (MCL 211.7u).",5003,"House Finance",2025-02-04,"Bill Electronically Reproduced 01/30/2025",https://legiscan.com/MI/bill/HB4041/2025,https://legislature.mi.gov/Bills/Bill?ObjectName=2025-HB-4041
1948644,2183,HB4042,1,Introduced,2025-01-30,"Food: service establishments; exemption for certain outdoor event spaces; provide for. Amends sec. 1107 of 2000 PA 92 (MCL 289.1107).","Food: service establishments; exemption for certain outdoor event spaces; provide for. Amends sec. 1107 of 2000 PA 92 (MCL 289.1107).",0,,2025-06-26,"Referred To Second Reading",https://legiscan.com/MI/bill/HB4042/2025,https://legislature.mi.gov/Bills/Bill?ObjectName=2025-HB-4042
1948705,2183,HB4043,1,Introduced,2025-01-30,"Liquor: licenses; providing refrigerator systems to certain licensees; allow. Amends sec. 609 of 1998 PA 58 (MCL 436.1609).","Liquor: licenses; providing refrigerator systems to certain licensees; allow. Amends sec. 609 of 1998 PA 58 (MCL 436.1609).",895,"House Regulatory Reform",2025-02-04,"Bill Electronically Reproduced 01/30/2025",https://legiscan.com/MI/bill/HB4043/2025,https://legislature.mi.gov/Bills/Bill?ObjectName=2025-HB-4043
1948813,2183,HB4044,2,Engrossed,2025-06-11,"State: symbol; wood duck; designate as the official state duck. Creates new act.","State: symbol; wood duck; designate as the official state duck. Creates new act.",0,,2025-08-13,"Rules Suspended For Immediate Consideration",https://legiscan.com/MI/bill/HB4044/2025,https://legislature.mi.gov/Bills/Bill?ObjectName=2025-HB-4044
1948327,2183,HB4045,1,Introduced,2025-01-30,"Civil procedure: civil actions; lawsuits for exercising rights to free expression; provide protections against. Creates new act.","Civil procedure: civil actions; lawsuits for exercising rights to free expression; provide protections against. Creates new act.",0,,2025-04-16,"Referred To Second Reading",https://legiscan.com/MI/bill/HB4045/2025,https://legislature.mi.gov/Bills/Bill?ObjectName=2025-HB-4045
1948929,2183,HB4046,4,Passed,2025-08-19,"Highways: memorial; portion of highway US-31; designate as the ""Trooper James E. Boland Memorial Highway"". Amends 2001 PA 142 (MCL 250.1001 - 250.2092) by adding sec. 11d.","Highways: memorial; portion of highway US-31; designate as the ""Trooper James E. Boland Memorial Highway"". Amends 2001 PA 142 (MCL 250.1001 - 250.2092) by adding sec. 11d.",0,,2025-08-19,"Assigned Pa 8'25 With Immediate Effect",https://legiscan.com/MI/bill/HB4046/2025,https://legislature.mi.gov/Bills/Bill?ObjectName=2025-HB-4046
1948377,2183,HB4047,4,Passed,2025-08-26,"Civil procedure: civil actions; cause of action for media that falsely depicts an individual engaging in sexual conduct; provide for. Creates new act.","Civil procedure: civil actions; cause of action for media that falsely depicts an individual engaging in sexual conduct; provide for. Creates new act.",0,,2025-08-26,"Assigned Pa 11'25 With Immediate Effect",https://legiscan.com/MI/bill/HB4047/2025,https://legislature.mi.gov/Bills/Bill?ObjectName=2025-HB-4047
1948980,2183,HB4048,4,Passed,2025-08-26,"Criminal procedure: sentencing guidelines; guidelines for dissemination of deep fake sexual images; enact. Amends sec. 17b, ch. XVII of 1927 PA 175 (MCL 777.17b). TIE BAR WITH: HB 4047'25","Criminal procedure: sentencing guidelines; guidelines for dissemination of deep fake sexual images; enact. Amends sec. 17b, ch. XVII of 1927 PA 175 (MCL 777.17b). TIE BAR WITH: HB 4047'25",0,,2025-08-26,"Assigned Pa 12'25 With Immediate Effect",https://legiscan.com/MI/bill/HB4048/2025,https://legislature.mi.gov/Bills/Bill?ObjectName=2025-HB-4048
1949090,2183,HB4049,1,Introduced,2025-01-30,"Land use: zoning and growth management; rearing of hen chickens in residential areas; allow. Amends sec. 204 of 2006 PA 110 (MCL 125.3204). TIE BAR WITH: HB 4050'25","Land use: zoning and growth management; rearing of hen chickens in residential areas; allow. Amends sec. 204 of 2006 PA 110 (MCL 125.3204). TIE BAR WITH: HB 4050'25",808,"House Agriculture",2025-02-04,"Bill Electronically Reproduced 01/30/2025",https://legiscan.com/MI/bill/HB4049/2025,https://legislature.mi.gov/Bills/Bill?ObjectName=2025-HB-4049
1948592,2183,HB4050,1,Introduced,2025-01-30,"Agriculture: animals; generally accepted agricultural and management practices for rearing egg-laying hens in residential areas under certain conditions; provide for. Amends sec. 4 of 1981 PA 93 (MCL 286.474). TIE BAR WITH: HB 4049'25","Agriculture: animals; generally accepted agricultural and management practices for rearing egg-laying hens in residential areas under certain conditions; provide for. Amends sec. 4 of 1981 PA 93 (MCL 286.474). TIE BAR WITH: HB 4049'25",808,"House Agriculture",2025-02-04,"Bill Electronically Reproduced 01/30/2025",https://legiscan.com/MI/bill/HB4050/2025,https://legislature.mi.gov/Bills/Bill?ObjectName=2025-HB-4050
1948537,2183,HB4051,1,Introduced,2025-01-30,"Individual income tax: deductions; exclusion of certain gratuities for tipped employees; provide for. Amends sec. 30 of 1967 PA 281 (MCL 206.30).","Individual income tax: deductions; exclusion of certain gratuities for tipped employees; provide for. Amends sec. 30 of 1967 PA 281 (MCL 206.30).",5003,"House Finance",2025-02-04,"Bill Electronically Reproduced 01/30/2025",https://legiscan.com/MI/bill/HB4051/2025,https://legislature.mi.gov/Bills/Bill?ObjectName=2025-HB-4051
1948432,2183,HB4052,2,Engrossed,2025-02-25,"Legislature: legislators; certain nondisclosure agreements entered into by legislators; prohibit. Creates new act. TIE BAR WITH: HB 4053'25","Legislature: legislators; certain nondisclosure agreements entered into by legislators; prohibit. Creates new act. TIE BAR WITH: HB 4053'25",838,"Senate Government Operations",2025-02-27,"Referred To Committee On Government Operations",https://legiscan.com/MI/bill/HB4052/2025,https://legislature.mi.gov/Bills/Bill?ObjectName=2025-HB-4052
1948484,2183,HB4053,2,Engrossed,2025-02-25,"Legislature: legislators; certain nondisclosure agreements entered into by legislators; prohibit. Creates new act. TIE BAR WITH: HB 4053'25","Legislature: legislators; certain nondisclosure agreements entered into by legislators; prohibit. Creates new act. TIE BAR WITH: HB 4053'25",838,"Senate Government Operations",2025-02-27,"Referred To Committee On Government Operations",https://legiscan.com/MI/bill/HB4053/2025,https://legislature.mi.gov/Bills/Bill?ObjectName=2025-HB-4053
1954228,2183,HB4054,1,Introduced,2025-02-04,"State: symbol; monarch butterfly; designate as the official state butterfly. Creates new act.","State: symbol; monarch butterfly; designate as the official state butterfly. Creates new act.",899,"House Government Operations",2025-02-05,"Bill Electronically Reproduced 02/04/2025",https://legiscan.com/MI/bill/HB4054/2025,https://legislature.mi.gov/Bills/Bill?ObjectName=2025-HB-4054
1954401,2183,HB4055,1,Introduced,2025-02-04,"Individual income tax: credit; child tax credit; provide for. Amends 1967 PA 281 (MCL 206.1 - 206.847) by adding sec. 275.","Individual income tax: credit; child tax credit; provide for. Amends 1967 PA 281 (MCL 206.1 - 206.847) by adding sec. 275.",5089,"House Economic Competitiveness",2025-02-05,"Bill Electronically Reproduced 02/04/2025",https://legiscan.com/MI/bill/HB4055/2025,https://legislature.mi.gov/Bills/Bill?ObjectName=2025-HB-4055
1955022,2183,HB4056,1,Introduced,2025-02-04,"Individual income tax: other; child care savings program; create. Creates new act. TIE BAR WITH: HB 4057'25","Individual income tax: other; child care savings program; create. Creates new act. TIE BAR WITH: HB 4057'25",5089,"House Economic Competitiveness",2025-02-05,"Bill Electronically Reproduced 02/04/2025",https://legiscan.com/MI/bill/HB4056/2025,https://legislature.mi.gov/Bills/Bill?ObjectName=2025-HB-4056
1954832,2183,HB4057,1,Introduced,2025-02-04,"Individual income tax: deductions; contributions to a child care savings account; deduct. Amends sec. 30 of 1967 PA 281 (MCL 206.30). TIE BAR WITH: HB 4056'25","Individual income tax: deductions; contributions to a child care savings account; deduct. Amends sec. 30 of 1967 PA 281 (MCL 206.30). TIE BAR WITH: HB 4056'25",5089,"House Economic Competitiveness",2025-02-05,"Bill Electronically Reproduced 02/04/2025",https://legiscan.com/MI/bill/HB4057/2025,https://legislature.mi.gov/Bills/Bill?ObjectName=2025-HB-4057
1954116,2183,HB4058,1,Introduced,2025-02-04,"Sales tax: exemptions; exemption for certain baby and toddler items; provide for. Amends 1933 PA 167 (MCL 205.51 - 205.78) by adding sec. 4mm.","Sales tax: exemptions; exemption for certain baby and toddler items; provide for. Amends 1933 PA 167 (MCL 205.51 - 205.78) by adding sec. 4mm.",5089,"House Economic Competitiveness",2025-02-05,"Bill Electronically Reproduced 02/04/2025",https://legiscan.com/MI/bill/HB4058/2025,https://legislature.mi.gov/Bills/Bill?ObjectName=2025-HB-4058
1954201,2183,HB4059,1,Introduced,2025-02-04,"Use tax: exemptions; exemption for certain baby and toddler items; provide for. Amends 1937 PA 94 (MCL 205.91 - 205.111) by adding sec. 4mm.","Use tax: exemptions; exemption for certain baby and toddler items; provide for. Amends 1937 PA 94 (MCL 205.91 - 205.111) by adding sec. 4mm.",5089,"House Economic Competitiveness",2025-02-05,"Bill Electronically Reproduced 02/04/2025",https://legiscan.com/MI/bill/HB4059/2025,https://legislature.mi.gov/Bills/Bill?ObjectName=2025-HB-4059
1954659,2183,HB4060,2,Engrossed,2025-03-12,"Education: financing; requirements concerning taxes levied for area career and technical education programs; modify. Amends secs. 681 & 684 of 1976 PA 451 (MCL 380.681 & 380.684).","Education: financing; requirements concerning taxes levied for area career and technical education programs; modify. Amends secs. 681 & 684 of 1976 PA 451 (MCL 380.681 & 380.684).",834,"Senate Education",2025-03-18,"Referred To Committee On Education",https://legiscan.com/MI/bill/HB4060/2025,https://legislature.mi.gov/Bills/Bill?ObjectName=2025-HB-4060
1954945,2183,HB4061,1,Introduced,2025-02-04,"Public employees and officers: state; state contractors; require to verify legal residency of employees. Creates new act.","Public employees and officers: state; state contractors; require to verify legal residency of employees. Creates new act.",899,"House Government Operations",2025-02-05,"Bill Electronically Reproduced 02/04/2025",https://legiscan.com/MI/bill/HB4061/2025,https://legislature.mi.gov/Bills/Bill?ObjectName=2025-HB-4061
1959442,2183,HB4062,2,Engrossed,2025-02-20,"Public employees and officers: ethics; former members of the legislature; prohibit from engaging in certain lobbying activities for a period of time. Amends sec. 6a of 1978 PA 472 (MCL 4.416a).","Public employees and officers: ethics; former members of the legislature; prohibit from engaging in certain lobbying activities for a period of time. Amends sec. 6a of 1978 PA 472 (MCL 4.416a).",3416,"Senate Oversight",2025-02-25,"Referred To Committee On Oversight",https://legiscan.com/MI/bill/HB4062/2025,https://legislature.mi.gov/Bills/Bill?ObjectName=2025-HB-4062
1959871,2183,HB4063,2,Engrossed,2025-02-20,"Public employees and officers: ethics; certain former officers of the executive branch of state government; prohibit from engaging in certain lobbying activities for a period of time. Amends 1978 PA 472 (MCL 4.411 - 4.431) by adding sec. 6b.","Public employees and officers: ethics; certain former officers of the executive branch of state government; prohibit from engaging in certain lobbying activities for a period of time. Amends 1978 PA 472 (MCL 4.411 - 4.431) by adding sec. 6b.",3416,"Senate Oversight",2025-02-25,"Referred To Committee On Oversight",https://legiscan.com/MI/bill/HB4063/2025,https://legislature.mi.gov/Bills/Bill?ObjectName=2025-HB-4063
1959658,2183,HB4064,2,Engrossed,2025-02-20,"Public employees and officers: ethics; state senators and representatives; prohibit from engaging in certain lobbying activities. Amends 1978 PA 472 (MCL 4.411 - 4.431) by adding sec. 6c.","Public employees and officers: ethics; state senators and representatives; prohibit from engaging in certain lobbying activities. Amends 1978 PA 472 (MCL 4.411 - 4.431) by adding sec. 6c.",3416,"Senate Oversight",2025-02-25,"Referred To Committee On Oversight",https://legiscan.com/MI/bill/HB4064/2025,https://legislature.mi.gov/Bills/Bill?ObjectName=2025-HB-4064
1960086,2183,HB4065,2,Engrossed,2025-03-18,"Liquor: licenses; license to serve alcohol at Macomb Community College Sports and Expo Center Complex; allow. Amends sec. 513 of 1998 PA 58 (MCL 436.1513).","Liquor: licenses; license to serve alcohol at Macomb Community College Sports and Expo Center Complex; allow. Amends sec. 513 of 1998 PA 58 (MCL 436.1513).",4828,"Senate Regulatory Affairs",2025-03-20,"Referred To Committee On Regulatory Affairs",https://legiscan.com/MI/bill/HB4065/2025,https://legislature.mi.gov/Bills/Bill?ObjectName=2025-HB-4065
1965041,2183,HB4066,2,Engrossed,2025-05-22,"Education: athletics; single-sex sports teams; require. Amends 1976 PA 451 (MCL 380.1 - 380.1852) by adding sec. 1290.","Education: athletics; single-sex sports teams; require. Amends 1976 PA 451 (MCL 380.1 - 380.1852) by adding sec. 1290.",838,"Senate Government Operations",2025-05-29,"Referred To Committee On Government Operations",https://legiscan.com/MI/bill/HB4066/2025,https://legislature.mi.gov/Bills/Bill?ObjectName=2025-HB-4066
1967128,2183,HB4067,1,Introduced,2025-02-12,"Children: protection; safe delivery of newborns law; modify definition of newborn and allow surrender to a newborn safety device. Amends secs. 1, 2, 3, 5, 7, 10, 17 & 20, ch. XII of 1939 PA 288 (MCL 712.1 et seq.) & adds sec. 3a to ch. XII.","Children: protection; safe delivery of newborns law; modify definition of newborn and allow surrender to a newborn safety device. Amends secs. 1, 2, 3, 5, 7, 10, 17 & 20, ch. XII of 1939 PA 288 (MCL 712.1 et seq.) & adds sec. 3a to ch. XII.",5139,"House Families And Veterans",2025-02-13,"Bill Electronically Reproduced 02/12/2025",https://legiscan.com/MI/bill/HB4067/2025,https://legislature.mi.gov/Bills/Bill?ObjectName=2025-HB-4067
1967154,2183,HB4068,1,Introduced,2025-02-12,"Children: protection; reporting death of a newborn after surrender to a newborn safety device; expand. Amends sec. 2843 of 1978 PA 368 (MCL 333.2843). TIE BAR WITH: HB 4067'25","Children: protection; reporting death of a newborn after surrender to a newborn safety device; expand. Amends sec. 2843 of 1978 PA 368 (MCL 333.2843). TIE BAR WITH: HB 4067'25",5139,"House Families And Veterans",2025-02-13,"Bill Electronically Reproduced 02/12/2025",https://legiscan.com/MI/bill/HB4068/2025,https://legislature.mi.gov/Bills/Bill?ObjectName=2025-HB-4068
1967097,2183,HB4069,1,Introduced,2025-02-12,"Children: protection; reference in Michigan penal code to surrender of a newborn under the newborn safe delivery law; revise. Amends sec. 135 of 1931 PA 328 (MCL 750.135). TIE BAR WITH: HB 4067'25","Children: protection; reference in Michigan penal code to surrender of a newborn under the newborn safe delivery law; revise. Amends sec. 135 of 1931 PA 328 (MCL 750.135). TIE BAR WITH: HB 4067'25",5139,"House Families And Veterans",2025-02-13,"Bill Electronically Reproduced 02/12/2025",https://legiscan.com/MI/bill/HB4069/2025,https://legislature.mi.gov/Bills/Bill?ObjectName=2025-HB-4069
1967006,2183,HB4070,1,Introduced,2025-02-12,"Courts: other; Michigan indigent defense commission act; expand duties to include indigent defense of youth. Amends title & secs. 3, 5, 7, 9, 11, 13, 15, 17, 21 & 23 of 2013 PA 93 (MCL 780.983 et seq.) & adds sec. 14.","Courts: other; Michigan indigent defense commission act; expand duties to include indigent defense of youth. Amends title & secs. 3, 5, 7, 9, 11, 13, 15, 17, 21 & 23 of 2013 PA 93 (MCL 780.983 et seq.) & adds sec. 14.",0,,2025-03-12,"Referred To Second Reading",https://legiscan.com/MI/bill/HB4070/2025,https://legislature.mi.gov/Bills/Bill?ObjectName=2025-HB-4070
1967037,2183,HB4071,2,Engrossed,2025-05-07,"Insurance: unfair trade practices; unfair trade practices in the insurance industry; revise. Amends sec. 2025 of 1956 PA 218 (MCL 500.2025).","Insurance: unfair trade practices; unfair trade practices in the insurance industry; revise. Amends sec. 2025 of 1956 PA 218 (MCL 500.2025).",4717,"Senate Finance, Insurance, And Consumer Protection",2025-05-13,"Referred To Committee On Finance, Insurance, And Consumer Protection",https://legiscan.com/MI/bill/HB4071/2025,https://legislature.mi.gov/Bills/Bill?ObjectName=2025-HB-4071
1967442,2183,HB4072,2,Engrossed,2025-05-07,"Health: pharmaceuticals; allow patients to take unused portion of eye drops or eye ointments after certain procedures for continued patient care; provide for. Amends 1978 PA 368 (MCL 333.1101 - 333.25211) by adding secs. 17773, 20817 & 21539.","Health: pharmaceuticals; allow patients to take unused portion of eye drops or eye ointments after certain procedures for continued patient care; provide for. Amends 1978 PA 368 (MCL 333.1101 - 333.25211) by adding secs. 17773, 20817 & 21539.",839,"Senate Health Policy",2025-05-13,"Referred To Committee On Health Policy",https://legiscan.com/MI/bill/HB4072/2025,https://legislature.mi.gov/Bills/Bill?ObjectName=2025-HB-4072
1967220,2183,HB4073,1,Introduced,2025-02-12,"Criminal procedure: warrants; statutory warrant requirement; provide for department of natural resources. Amends sec. 1602 of 1994 PA 451 (MCL 324.1602) & adds sec. 1507.","Criminal procedure: warrants; statutory warrant requirement; provide for department of natural resources. Amends sec. 1602 of 1994 PA 451 (MCL 324.1602) & adds sec. 1507.",5004,"House Natural Resources And Tourism",2025-02-13,"Bill Electronically Reproduced 02/12/2025",https://legiscan.com/MI/bill/HB4073/2025,https://legislature.mi.gov/Bills/Bill?ObjectName=2025-HB-4073
1967347,2183,HB4074,1,Introduced,2025-02-12,"Law enforcement: peace officers; conservation officers to wear body cams while on patrol; require. Amends 1986 PA 109 (MCL 300.21 - 300.22) by adding sec. 1a.","Law enforcement: peace officers; conservation officers to wear body cams while on patrol; require. Amends 1986 PA 109 (MCL 300.21 - 300.22) by adding sec. 1a.",5004,"House Natural Resources And Tourism",2025-02-13,"Bill Electronically Reproduced 02/12/2025",https://legiscan.com/MI/bill/HB4074/2025,https://legislature.mi.gov/Bills/Bill?ObjectName=2025-HB-4074
1967408,2183,HB4075,1,Introduced,2025-02-12,"Labor: hours and wages; minimum wage; modify. Amends sec. 4 of 2018 PA 337 (MCL 408.934).","Labor: hours and wages; minimum wage; modify. Amends sec. 4 of 2018 PA 337 (MCL 408.934).",5089,"House Economic Competitiveness",2025-02-13,"Bill Electronically Reproduced 02/12/2025",https://legiscan.com/MI/bill/HB4075/2025,https://legislature.mi.gov/Bills/Bill?ObjectName=2025-HB-4075
1967188,2183,HB4076,2,Engrossed,2025-05-13,"Food: other; labeling lab-grown meat as meat; prohibit. Amends sec. 7129 of 2000 PA 92 (MCL 289.7129).","Food: other; labeling lab-grown meat as meat; prohibit. Amends sec. 7129 of 2000 PA 92 (MCL 289.7129).",4774,"Senate Natural Resources And Agriculture",2025-05-15,"Referred To Committee On Natural Resources And Agriculture",https://legiscan.com/MI/bill/HB4076/2025,https://legislature.mi.gov/Bills/Bill?ObjectName=2025-HB-4076
1967316,2183,HB4077,2,Engrossed,2025-04-22,"Health: medical examiners; process for medical certification of a death record; modify. Amends secs. 2804, 2843, 2843b, 2844 & 16221 of 1978 PA 368 (MCL 333.2804 et seq.).","Health: medical examiners; process for medical certification of a death record; modify. Amends secs. 2804, 2843, 2843b, 2844 & 16221 of 1978 PA 368 (MCL 333.2804 et seq.).",839,"Senate Health Policy",2025-04-29,"Referred To Committee On Health Policy",https://legiscan.com/MI/bill/HB4077/2025,https://legislature.mi.gov/Bills/Bill?ObjectName=2025-HB-4077
1967472,2183,HB4078,2,Engrossed,2025-04-22,"Health: medical examiners; requirements for an investigation of the cause and manner of death; modify. Amends secs. 2 & 3 of 1953 PA 181 (MCL 52.202 & 52.203). TIE BAR WITH: HB 4077'25","Health: medical examiners; requirements for an investigation of the cause and manner of death; modify. Amends secs. 2 & 3 of 1953 PA 181 (MCL 52.202 & 52.203). TIE BAR WITH: HB 4077'25",839,"Senate Health Policy",2025-04-29,"Referred To Committee On Health Policy",https://legiscan.com/MI/bill/HB4078/2025,https://legislature.mi.gov/Bills/Bill?ObjectName=2025-HB-4078
1967502,2183,HB4079,1,Introduced,2025-02-12,"Property tax: special assessments; income eligibility cap for special assessment deferment program; modify. Amends secs. 3 & 4 of 1976 PA 225 (MCL 211.763 & 211.764). TIE BAR WITH: HB 4080'25","Property tax: special assessments; income eligibility cap for special assessment deferment program; modify. Amends secs. 3 & 4 of 1976 PA 225 (MCL 211.763 & 211.764). TIE BAR WITH: HB 4080'25",0,,2025-04-15,"Referred To Second Reading",https://legiscan.com/MI/bill/HB4079/2025,https://legislature.mi.gov/Bills/Bill?ObjectName=2025-HB-4079
1967380,2183,HB4080,1,Introduced,2025-02-12,"Property tax: special assessments; special assessment deferment program; reinstate. Amends secs. 1 & 2 of 1976 PA 225 (MCL 211.761 & 211.762). TIE BAR WITH: HB 4079'25","Property tax: special assessments; special assessment deferment program; reinstate. Amends secs. 1 & 2 of 1976 PA 225 (MCL 211.761 & 211.762). TIE BAR WITH: HB 4079'25",0,,2025-04-15,"Referred To Second Reading",https://legiscan.com/MI/bill/HB4080/2025,https://legislature.mi.gov/Bills/Bill?ObjectName=2025-HB-4080
1967066,2183,HB4081,2,Engrossed,2025-04-16,"Land use: land division; number of parcels resulting from division; authorize counties and municipalities to increase. Amends sec. 108 of 1967 PA 288 (MCL 560.108).","Land use: land division; number of parcels resulting from division; authorize counties and municipalities to increase. Amends sec. 108 of 1967 PA 288 (MCL 560.108).",0,,2025-08-13,"Rules Suspended For Immediate Consideration",https://legiscan.com/MI/bill/HB4081/2025,https://legislature.mi.gov/Bills/Bill?ObjectName=2025-HB-4081
1967250,2183,HB4082,1,Introduced,2025-02-12,"School aid: membership; requirements concerning counting pupils in membership; modify for pupils enrolled in certain work-based learning experiences. Amends secs. 6 & 11 of 1979 PA 94 (MCL 388.1606 & 388.1611) & adds sec. 61e.","School aid: membership; requirements concerning counting pupils in membership; modify for pupils enrolled in certain work-based learning experiences. Amends secs. 6 & 11 of 1979 PA 94 (MCL 388.1606 & 388.1611) & adds sec. 61e.",889,"House Appropriations",2025-02-13,"Bill Electronically Reproduced 02/12/2025",https://legiscan.com/MI/bill/HB4082/2025,https://legislature.mi.gov/Bills/Bill?ObjectName=2025-HB-4082
1967287,2183,HB4083,1,Introduced,2025-02-12,"Food: meats; production and sale of lab-grown meat; prohibit. Amends secs. 5107 & 7129 of 2000 PA 92 (MCL 289.5107 & 289.7129).","Food: meats; production and sale of lab-grown meat; prohibit. Amends secs. 5107 & 7129 of 2000 PA 92 (MCL 289.5107 & 289.7129).",808,"House Agriculture",2025-02-13,"Bill Electronically Reproduced 02/12/2025",https://legiscan.com/MI/bill/HB4083/2025,https://legislature.mi.gov/Bills/Bill?ObjectName=2025-HB-4083
1969146,2183,HB4084,1,Introduced,2025-02-13,"Transportation: funds; funding for sound wall projects; provide for. Amends 1951 PA 51 (MCL 247.651 - 247.675) by adding sec. 14b.","Transportation: funds; funding for sound wall projects; provide for. Amends 1951 PA 51 (MCL 247.651 - 247.675) by adding sec. 14b.",0,,2025-04-30,"Referred To Second Reading",https://legiscan.com/MI/bill/HB4084/2025,https://legislature.mi.gov/Bills/Bill?ObjectName=2025-HB-4084
1969433,2183,HB4085,1,Introduced,2025-02-13,"Land use: zoning and growth management; mining cryptocurrency inside of an area that is zoned for industrial use; allow. Amends 2006 PA 110 (MCL 125.3101 - 125.3702) by adding sec. 515.","Land use: zoning and growth management; mining cryptocurrency inside of an area that is zoned for industrial use; allow. Amends 2006 PA 110 (MCL 125.3101 - 125.3702) by adding sec. 515.",3164,"House Communications And Technology",2025-02-18,"Bill Electronically Reproduced 02/13/2025",https://legiscan.com/MI/bill/HB4085/2025,https://legislature.mi.gov/Bills/Bill?ObjectName=2025-HB-4085
1970010,2183,HB4086,1,Introduced,2025-02-13,"State finance: other; office of the Michigan bullion depository and Michcoin act; create. Creates new act.","State finance: other; office of the Michigan bullion depository and Michcoin act; create. Creates new act.",3164,"House Communications And Technology",2025-02-18,"Bill Electronically Reproduced 02/13/2025",https://legiscan.com/MI/bill/HB4086/2025,https://legislature.mi.gov/Bills/Bill?ObjectName=2025-HB-4086
1969721,2183,HB4087,1,Introduced,2025-02-13,"State finance: other; strategic bitcoin reserve; establish. Amends sec. 351 of 1984 PA 431 (MCL 18.1351) by adding sec. 351a.","State finance: other; strategic bitcoin reserve; establish. Amends sec. 351 of 1984 PA 431 (MCL 18.1351) by adding sec. 351a.",3164,"House Communications And Technology",2025-02-18,"Bill Electronically Reproduced 02/13/2025",https://legiscan.com/MI/bill/HB4087/2025,https://legislature.mi.gov/Bills/Bill?ObjectName=2025-HB-4087
1973432,2183,HB4088,1,Introduced,2025-02-18,"Individual income tax: property tax credit; taxable value cap on homestead eligibility for credit; increase and modify adjustment factor. Amends sec. 520 of 1967 PA 281 (MCL 206.520).","Individual income tax: property tax credit; taxable value cap on homestead eligibility for credit; increase and modify adjustment factor. Amends sec. 520 of 1967 PA 281 (MCL 206.520).",5003,"House Finance",2025-02-19,"Bill Electronically Reproduced 02/18/2025",https://legiscan.com/MI/bill/HB4088/2025,https://legislature.mi.gov/Bills/Bill?ObjectName=2025-HB-4088
1975643,2183,HB4089,1,Introduced,2025-02-19,"Highways: memorial; portion of US-10 in Midland; designate as the ""Army Specialist Levi K. Hoover Memorial Highway"". Amends 2001 PA 142 (MCL 250.1001 - 250.2092) by adding sec. 16e.","Highways: memorial; portion of US-10 in Midland; designate as the ""Army Specialist Levi K. Hoover Memorial Highway"". Amends 2001 PA 142 (MCL 250.1001 - 250.2092) by adding sec. 16e.",2834,"House Transportation And Infrastructure",2025-02-19,"Bill Electronically Reproduced 02/19/2025",https://legiscan.com/MI/bill/HB4089/2025,https://legislature.mi.gov/Bills/Bill?ObjectName=2025-HB-4089
1975506,2183,HB4090,4,Passed,2025-07-01,"Property: conveyance of state property; transfer of certain state-owned property in Detroit; provide for. Creates land transfer act.","Property: conveyance of state property; transfer of certain state-owned property in Detroit; provide for. Creates land transfer act.",0,,2025-07-01,"Assigned Pa 6'25 With Immediate Effect",https://legiscan.com/MI/bill/HB4090/2025,https://legislature.mi.gov/Bills/Bill?ObjectName=2025-HB-4090
1975616,2183,HB4091,1,Introduced,2025-02-19,"Courts: juries; local jury boards; eliminate, and create a centralized jury process. Amends secs. 857, 1301a, 1304a, 1307a, 1326, 1332, 1334, 1343, 1344, 1345, 1346, 1371 & 1372 of 1961 PA 236 (MCL 600.857 et seq.); adds secs. 1306 & 1307 & repeals (See bill).","Courts: juries; local jury boards; eliminate, and create a centralized jury process. Amends secs. 857, 1301a, 1304a, 1307a, 1326, 1332, 1334, 1343, 1344, 1345, 1346, 1371 & 1372 of 1961 PA 236 (MCL 600.857 et seq.); adds secs. 1306 & 1307 & repeals (See bill).",821,"House Judiciary",2025-02-19,"Bill Electronically Reproduced 02/19/2025",https://legiscan.com/MI/bill/HB4091/2025,https://legislature.mi.gov/Bills/Bill?ObjectName=2025-HB-4091
1975317,2183,HB4092,1,Introduced,2025-02-19,"Courts: juries; reference in the probate code; amend to reflect repeal. Amends sec. 17, ch. XIIA of 1939 PA 288 (MCL 712A.17). TIE BAR WITH: HB 4091'25","Courts: juries; reference in the probate code; amend to reflect repeal. Amends sec. 17, ch. XIIA of 1939 PA 288 (MCL 712A.17). TIE BAR WITH: HB 4091'25",821,"House Judiciary",2025-02-19,"Bill Electronically Reproduced 02/19/2025",https://legiscan.com/MI/bill/HB4092/2025,https://legislature.mi.gov/Bills/Bill?ObjectName=2025-HB-4092
1975278,2183,HB4093,1,Introduced,2025-02-19,"Courts: juries; reference in the uniform condemnation procedures act; amend to reflect repeal. Amends sec. 12 of 1980 PA 87 (MCL 213.62). TIE BAR WITH: HB 4091'25","Courts: juries; reference in the uniform condemnation procedures act; amend to reflect repeal. Amends sec. 12 of 1980 PA 87 (MCL 213.62). TIE BAR WITH: HB 4091'25",821,"House Judiciary",2025-02-19,"Bill Electronically Reproduced 02/19/2025",https://legiscan.com/MI/bill/HB4093/2025,https://legislature.mi.gov/Bills/Bill?ObjectName=2025-HB-4093
1975542,2183,HB4094,1,Introduced,2025-02-19,"Courts: juries; prospective jurors with certain criminal records and protected statuses; amend eligibility for service and peremptory challenges. Amends sec. 1307a of 1961 PA 236 (MCL 600.1307a) & adds secs. 1307b & 1356.","Courts: juries; prospective jurors with certain criminal records and protected statuses; amend eligibility for service and peremptory challenges. Amends sec. 1307a of 1961 PA 236 (MCL 600.1307a) & adds secs. 1307b & 1356.",821,"House Judiciary",2025-02-19,"Bill Electronically Reproduced 02/19/2025",https://legiscan.com/MI/bill/HB4094/2025,https://legislature.mi.gov/Bills/Bill?ObjectName=2025-HB-4094
1977614,2183,HB4095,1,Introduced,2025-02-20,"Insurance: insurers; insurance providers to panel a mental health provider within a certain time period of application process; require. Amends 1956 PA 218 (MCL 500.100 - 500.8302) by adding sec. 3406ss.","Insurance: insurers; insurance providers to panel a mental health provider within a certain time period of application process; require. Amends 1956 PA 218 (MCL 500.100 - 500.8302) by adding sec. 3406ss.",894,"House Insurance",2025-02-25,"Bill Electronically Reproduced 02/20/2025",https://legiscan.com/MI/bill/HB4095/2025,https://legislature.mi.gov/Bills/Bill?ObjectName=2025-HB-4095
1977762,2183,HB4096,1,Introduced,2025-02-20,"Worker's compensation: disabilities; presumption of causation of heart and respiratory diseases; extend to certain members of police, fire, and public safety departments. Amends sec. 405 of 1969 PA 317 (MCL 418.405).","Worker's compensation: disabilities; presumption of causation of heart and respiratory diseases; extend to certain members of police, fire, and public safety departments. Amends sec. 405 of 1969 PA 317 (MCL 418.405).",899,"House Government Operations",2025-02-25,"Bill Electronically Reproduced 02/20/2025",https://legiscan.com/MI/bill/HB4096/2025,https://legislature.mi.gov/Bills/Bill?ObjectName=2025-HB-4096
1977293,2183,HB4097,1,Introduced,2025-02-20,"Construction: public buildings; placement of certain antennas on public school buildings, rooftops, and adjacent structures; prohibit. Amends 1937 PA 306 (MCL 388.851 - 388.855a) by adding sec. 1e.","Construction: public buildings; placement of certain antennas on public school buildings, rooftops, and adjacent structures; prohibit. Amends 1937 PA 306 (MCL 388.851 - 388.855a) by adding sec. 1e.",895,"House Regulatory Reform",2025-02-25,"Bill Electronically Reproduced 02/20/2025",https://legiscan.com/MI/bill/HB4097/2025,https://legislature.mi.gov/Bills/Bill?ObjectName=2025-HB-4097
1977249,2183,HB4098,2,Engrossed,2025-03-18,"Property tax: tax tribunal; methods for tax tribunal to hold hearings; expand to include electronically. Amends secs. 26 & 34 of 1973 PA 186 (MCL 205.726 & 205.734). TIE BAR WITH: HB 4099'25","Property tax: tax tribunal; methods for tax tribunal to hold hearings; expand to include electronically. Amends secs. 26 & 34 of 1973 PA 186 (MCL 205.726 & 205.734). TIE BAR WITH: HB 4099'25",4717,"Senate Finance, Insurance, And Consumer Protection",2025-03-20,"Referred To Committee On Finance, Insurance, And Consumer Protection",https://legiscan.com/MI/bill/HB4098/2025,https://legislature.mi.gov/Bills/Bill?ObjectName=2025-HB-4098
1977461,2183,HB4099,2,Engrossed,2025-03-18,"Civil rights: open meetings; electronic hearings of the tax tribunal; permit under the open meetings act. Amends sec. 3a of 1976 PA 267 (MCL 15.263a). TIE BAR WITH: HB 4098'25","Civil rights: open meetings; electronic hearings of the tax tribunal; permit under the open meetings act. Amends sec. 3a of 1976 PA 267 (MCL 15.263a). TIE BAR WITH: HB 4098'25",4717,"Senate Finance, Insurance, And Consumer Protection",2025-03-20,"Referred To Committee On Finance, Insurance, And Consumer Protection",https://legiscan.com/MI/bill/HB4099/2025,https://legislature.mi.gov/Bills/Bill?ObjectName=2025-HB-4099
1977509,2183,HB4100,2,Engrossed,2025-05-20,"Highways: memorial; portion of M-50; designate as the ""Animal Control Officer Darrian Young Memorial Highway."" Amends 2001 PA 142 (MCL 250.1001 - 250.2092) by adding sec. 6d.","Highways: memorial; portion of M-50; designate as the ""Animal Control Officer Darrian Young Memorial Highway."" Amends 2001 PA 142 (MCL 250.1001 - 250.2092) by adding sec. 6d.",3189,"Senate Local Government",2025-05-29,"Referred To Committee On Local Government",https://legiscan.com/MI/bill/HB4100/2025,https://legislature.mi.gov/Bills/Bill?ObjectName=2025-HB-4100
1977719,2183,HB4101,2,Engrossed,2025-05-22,"Health occupations: physical therapists; physical therapy licensure compact; enact. Amends 1978 PA 368 (MCL 333.1101 - 333.25211) by adding sec. 16188. TIE BAR WITH: HB 4102'25","Health occupations: physical therapists; physical therapy licensure compact; enact. Amends 1978 PA 368 (MCL 333.1101 - 333.25211) by adding sec. 16188. TIE BAR WITH: HB 4102'25",0,,2025-09-09,"Laid Over One Day Under The Rules",https://legiscan.com/MI/bill/HB4101/2025,https://legislature.mi.gov/Bills/Bill?ObjectName=2025-HB-4101
1977195,2183,HB4102,1,Introduced,2025-02-20,"Health occupations: physical therapists; licensing process; modify to incorporate physical therapy licensing compact. Amends secs. 16335, 17801 & 17821 of 1978 PA 368 (MCL 333.16335 et seq.) & adds secs. 17820a & 17820b. TIE BAR WITH: HB 4101'25","Health occupations: physical therapists; licensing process; modify to incorporate physical therapy licensing compact. Amends secs. 16335, 17801 & 17821 of 1978 PA 368 (MCL 333.16335 et seq.) & adds secs. 17820a & 17820b. TIE BAR WITH: HB 4101'25",892,"House Health Policy",2025-02-25,"Bill Electronically Reproduced 02/20/2025",https://legiscan.com/MI/bill/HB4102/2025,https://legislature.mi.gov/Bills/Bill?ObjectName=2025-HB-4102
1977353,2183,HB4103,2,Engrossed,2025-05-13,"Health occupations: occupational therapists; occupational therapy licensure compact; enact. Amends 1978 PA 368 (MCL 333.1101 - 333.25211) by adding sec. 16188. TIE BAR WITH: HB 4104'25","Health occupations: occupational therapists; occupational therapy licensure compact; enact. Amends 1978 PA 368 (MCL 333.1101 - 333.25211) by adding sec. 16188. TIE BAR WITH: HB 4104'25",0,,2025-09-11,"Placed On Order Of Third Reading With Substitute (s-1)",https://legiscan.com/MI/bill/HB4103/2025,https://legislature.mi.gov/Bills/Bill?ObjectName=2025-HB-4103
1977565,2183,HB4104,2,Engrossed,2025-05-13,"Health occupations: occupational therapists; licensure process for occupational therapists; modify to incorporate occupational therapy licensure compact. Amends secs. 16345, 18301 & 18305 of 1978 PA 368 (MCL 333.16345 et seq.) & adds secs. 18303a & 18303b. TIE BAR WITH: HB 4103'25","Health occupations: occupational therapists; licensure process for occupational therapists; modify to incorporate occupational therapy licensure compact. Amends secs. 16345, 18301 & 18305 of 1978 PA 368 (MCL 333.16345 et seq.) & adds secs. 18303a & 18303b. TIE BAR WITH: HB 4103'25",0,,2025-09-11,"Placed On Order Of Third Reading With Substitute (s-1)",https://legiscan.com/MI/bill/HB4104/2025,https://legislature.mi.gov/Bills/Bill?ObjectName=2025-HB-4104
1977397,2183,HB4105,2,Engrossed,2025-05-20,"Highways: memorial; portion of M-150; designate as the ""William S. Broomfield Memorial Highway"". Amends 2001 PA 142 (MCL 250.1001 - 250.2092) by adding sec. 109.","Highways: memorial; portion of M-150; designate as the ""William S. Broomfield Memorial Highway"". Amends 2001 PA 142 (MCL 250.1001 - 250.2092) by adding sec. 109.",3836,"Senate Transportation And Infrastructure",2025-05-29,"Referred To Committee On Transportation And Infrastructure",https://legiscan.com/MI/bill/HB4105/2025,https://legislature.mi.gov/Bills/Bill?ObjectName=2025-HB-4105
1977666,2183,HB4106,1,Introduced,2025-02-20,"Appropriations: supplemental; funding for small business payroll; provide for. Creates appropriation act.","Appropriations: supplemental; funding for small business payroll; provide for. Creates appropriation act.",889,"House Appropriations",2025-02-25,"Bill Electronically Reproduced 02/20/2025",https://legiscan.com/MI/bill/HB4106/2025,https://legislature.mi.gov/Bills/Bill?ObjectName=2025-HB-4106
1983123,2183,HB4107,1,Introduced,2025-02-25,"Education: other; recommended model core academic curriculum content standards for health education and certain guidelines for health education; modify. Amends sec. 1170a of 1976 PA 451 (MCL 380.1170a).","Education: other; recommended model core academic curriculum content standards for health education and certain guidelines for health education; modify. Amends sec. 1170a of 1976 PA 451 (MCL 380.1170a).",892,"House Health Policy",2025-02-26,"Bill Electronically Reproduced 02/25/2025",https://legiscan.com/MI/bill/HB4107/2025,https://legislature.mi.gov/Bills/Bill?ObjectName=2025-HB-4107
1983317,2183,HB4108,1,Introduced,2025-02-25,"Torts: liability; immunity for individuals rendering emergency services who apply bleeding control; provide for. Amends 1963 PA 17 (MCL 691.1501 - 681.1507) by adding sec. 8. TIE BAR WITH: HB 4109'25","Torts: liability; immunity for individuals rendering emergency services who apply bleeding control; provide for. Amends 1963 PA 17 (MCL 691.1501 - 681.1507) by adding sec. 8. TIE BAR WITH: HB 4109'25",892,"House Health Policy",2025-02-26,"Bill Electronically Reproduced 02/25/2025",https://legiscan.com/MI/bill/HB4108/2025,https://legislature.mi.gov/Bills/Bill?ObjectName=2025-HB-4108
1983349,2183,HB4109,1,Introduced,2025-02-25,"Recreation: other; act regarding medical emergencies in health clubs; revise cross-reference to the Good Samaritan Act. Amends sec. 3 of 2006 PA 23 (MCL 333.26313). TIE BAR WITH: HB 4108'25","Recreation: other; act regarding medical emergencies in health clubs; revise cross-reference to the Good Samaritan Act. Amends sec. 3 of 2006 PA 23 (MCL 333.26313). TIE BAR WITH: HB 4108'25",892,"House Health Policy",2025-02-26,"Bill Electronically Reproduced 02/25/2025",https://legiscan.com/MI/bill/HB4109/2025,https://legislature.mi.gov/Bills/Bill?ObjectName=2025-HB-4109
1983411,2183,HB4110,1,Introduced,2025-02-25,"Property: land sales; seller disclosure statement; require to reflect yearly property taxes based on current assessed value of property. Amends sec. 7 of 1993 PA 92 (MCL 565.957).","Property: land sales; seller disclosure statement; require to reflect yearly property taxes based on current assessed value of property. Amends sec. 7 of 1993 PA 92 (MCL 565.957).",895,"House Regulatory Reform",2025-02-26,"Bill Electronically Reproduced 02/25/2025",https://legiscan.com/MI/bill/HB4110/2025,https://legislature.mi.gov/Bills/Bill?ObjectName=2025-HB-4110
1983445,2183,HB4111,1,Introduced,2025-02-25,"Property tax: exemptions; personal property constituting certain hydrogen fuel pumps; exempt. Amends secs. 27 & 34d of 1893 PA 206 (MCL 211.27 & 211.34d) & adds sec. 9q. TIE BAR WITH: HB 4112'25","Property tax: exemptions; personal property constituting certain hydrogen fuel pumps; exempt. Amends secs. 27 & 34d of 1893 PA 206 (MCL 211.27 & 211.34d) & adds sec. 9q. TIE BAR WITH: HB 4112'25",5003,"House Finance",2025-02-26,"Bill Electronically Reproduced 02/25/2025",https://legiscan.com/MI/bill/HB4111/2025,https://legislature.mi.gov/Bills/Bill?ObjectName=2025-HB-4111
1982961,2183,HB4112,1,Introduced,2025-02-25,"Economic development: Michigan economic growth authority; definition of new construction under the Michigan economic growth authority act; modify. Amends sec. 3 of 1995 PA 24 (MCL 207.803). TIE BAR WITH: HB 4111'25","Economic development: Michigan economic growth authority; definition of new construction under the Michigan economic growth authority act; modify. Amends sec. 3 of 1995 PA 24 (MCL 207.803). TIE BAR WITH: HB 4111'25",5003,"House Finance",2025-02-26,"Bill Electronically Reproduced 02/25/2025",https://legiscan.com/MI/bill/HB4112/2025,https://legislature.mi.gov/Bills/Bill?ObjectName=2025-HB-4112
1983280,2183,HB4113,2,Engrossed,2025-06-04,"Liquor: other; discount for specially designated distributors and on-premises licensees; increase. Amends sec. 233 of 1998 PA 58 (MCL 436.1233).","Liquor: other; discount for specially designated distributors and on-premises licensees; increase. Amends sec. 233 of 1998 PA 58 (MCL 436.1233).",4828,"Senate Regulatory Affairs",2025-06-10,"Referred To Committee On Regulatory Affairs",https://legiscan.com/MI/bill/HB4113/2025,https://legislature.mi.gov/Bills/Bill?ObjectName=2025-HB-4113
1983475,2183,HB4114,2,Engrossed,2025-06-04,"Liquor: liquor control commission; certain liquor code violations not held against a licensee after a certain time; provide for. Amends 1998 PA 58 (MCL 436.1101 - 436.2303) by adding sec. 910.","Liquor: liquor control commission; certain liquor code violations not held against a licensee after a certain time; provide for. Amends 1998 PA 58 (MCL 436.1101 - 436.2303) by adding sec. 910.",4828,"Senate Regulatory Affairs",2025-06-10,"Referred To Committee On Regulatory Affairs",https://legiscan.com/MI/bill/HB4114/2025,https://legislature.mi.gov/Bills/Bill?ObjectName=2025-HB-4114
1983506,2183,HB4115,2,Engrossed,2025-03-20,"Occupations: pawnbrokers; civil sanctions for violation of allowable rate of interest charged by pawnbrokers; prescribe. Amends title & sec. 18 of 1917 PA 273 (MCL 446.218). TIE BAR WITH: HB 4116'25","Occupations: pawnbrokers; civil sanctions for violation of allowable rate of interest charged by pawnbrokers; prescribe. Amends title & sec. 18 of 1917 PA 273 (MCL 446.218). TIE BAR WITH: HB 4116'25",4717,"Senate Finance, Insurance, And Consumer Protection",2025-04-15,"Referred To Committee On Finance, Insurance, And Consumer Protection",https://legiscan.com/MI/bill/HB4115/2025,https://legislature.mi.gov/Bills/Bill?ObjectName=2025-HB-4115
1982991,2183,HB4116,2,Engrossed,2025-03-20,"Occupations: pawnbrokers; allowable rate of interest changed by pawnbrokers, increase. Amends secs. 8 & 9 of 1917 PA 273 (MCL 446.208 & 446.209). TIE BAR WITH: HB 4115'25","Occupations: pawnbrokers; allowable rate of interest changed by pawnbrokers, increase. Amends secs. 8 & 9 of 1917 PA 273 (MCL 446.208 & 446.209). TIE BAR WITH: HB 4115'25",4717,"Senate Finance, Insurance, And Consumer Protection",2025-04-15,"Referred To Committee On Finance, Insurance, And Consumer Protection",https://legiscan.com/MI/bill/HB4116/2025,https://legislature.mi.gov/Bills/Bill?ObjectName=2025-HB-4116
1983060,2183,HB4117,1,Introduced,2025-02-25,"Animals: other; animal industry act; modify. Amends sec. 46 of 1988 PA 466 (MCL 287.746).","Animals: other; animal industry act; modify. Amends sec. 46 of 1988 PA 466 (MCL 287.746).",808,"House Agriculture",2025-02-26,"Bill Electronically Reproduced 02/25/2025",https://legiscan.com/MI/bill/HB4117/2025,https://legislature.mi.gov/Bills/Bill?ObjectName=2025-HB-4117
1983538,2183,HB4118,2,Engrossed,2025-05-13,"Drains: financing; special assessments; provide for levy against DNR lands. Amends secs. 151, 154, 280, 468 & 520 of 1956 PA 40 (MCL 280.151 et seq.).","Drains: financing; special assessments; provide for levy against DNR lands. Amends secs. 151, 154, 280, 468 & 520 of 1956 PA 40 (MCL 280.151 et seq.).",4717,"Senate Finance, Insurance, And Consumer Protection",2025-05-15,"Referred To Committee On Finance, Insurance, And Consumer Protection",https://legiscan.com/MI/bill/HB4118/2025,https://legislature.mi.gov/Bills/Bill?ObjectName=2025-HB-4118
1982930,2183,HB4119,1,Introduced,2025-02-25,"Sales tax: exemptions; purchase of certain aircraft and aviation equipment; exempt. Amends sec. 4x of 1933 PA 167 (MCL 205.54x).","Sales tax: exemptions; purchase of certain aircraft and aviation equipment; exempt. Amends sec. 4x of 1933 PA 167 (MCL 205.54x).",0,,2025-05-06,"Referred To Second Reading",https://legiscan.com/MI/bill/HB4119/2025,https://legislature.mi.gov/Bills/Bill?ObjectName=2025-HB-4119
1983152,2183,HB4120,1,Introduced,2025-02-25,"Use tax: exemptions; purchase of certain aircraft and aviation equipment; exempt. Amends sec. 4k of 1937 PA 94 (MCL 205.94k).","Use tax: exemptions; purchase of certain aircraft and aviation equipment; exempt. Amends sec. 4k of 1937 PA 94 (MCL 205.94k).",0,,2025-05-06,"Referred To Second Reading",https://legiscan.com/MI/bill/HB4120/2025,https://legislature.mi.gov/Bills/Bill?ObjectName=2025-HB-4120
1982778,2183,HB4121,1,Introduced,2025-02-25,"Property tax: other; locally adopted cap on a local unit's own authority to levy a property tax millage; prohibit. Amends 1893 PA 206 (MCL 211.1 - 211.155) by adding sec. 34f.","Property tax: other; locally adopted cap on a local unit's own authority to levy a property tax millage; prohibit. Amends 1893 PA 206 (MCL 211.1 - 211.155) by adding sec. 34f.",899,"House Government Operations",2025-02-26,"Bill Electronically Reproduced 02/25/2025",https://legiscan.com/MI/bill/HB4121/2025,https://legislature.mi.gov/Bills/Bill?ObjectName=2025-HB-4121
1983249,2183,HB4122,2,Engrossed,2025-04-22,"Food: cottage food operation; certain requirements for cottage food operations and cottage food products; modify. Amends sec. 1105, 1111 & 4102 of 2000 PA 92 (MCL 289.1105 et seq.).","Food: cottage food operation; certain requirements for cottage food operations and cottage food products; modify. Amends sec. 1105, 1111 & 4102 of 2000 PA 92 (MCL 289.1105 et seq.).",4828,"Senate Regulatory Affairs",2025-04-29,"Referred To Committee On Regulatory Affairs",https://legiscan.com/MI/bill/HB4122/2025,https://legislature.mi.gov/Bills/Bill?ObjectName=2025-HB-4122
1982868,2183,HB4123,1,Introduced,2025-02-25,"Higher education: financial aid; Michigan reconnect program; modify. Amends secs. 3 & 7 of 2020 PA 84 (MCL 390.1703 & 390.1707).","Higher education: financial aid; Michigan reconnect program; modify. Amends secs. 3 & 7 of 2020 PA 84 (MCL 390.1703 & 390.1707).",889,"House Appropriations",2025-02-26,"Bill Electronically Reproduced 02/25/2025",https://legiscan.com/MI/bill/HB4123/2025,https://legislature.mi.gov/Bills/Bill?ObjectName=2025-HB-4123
1982900,2183,HB4124,1,Introduced,2025-02-25,"Corporate income tax: credits; credit for advanced small modular reactors research and development expenses; provide for. Amends 1967 PA 281 (MCL 206.1 - 206.847) by adding secs. 677a & 717a. TIE BAR WITH: HB 4127'25, HB 4129'25, HB 4125'25, HB 4126'25, HB 4128'25","Corporate income tax: credits; credit for advanced small modular reactors research and development expenses; provide for. Amends 1967 PA 281 (MCL 206.1 - 206.847) by adding secs. 677a & 717a. TIE BAR WITH: HB 4127'25, HB 4129'25, HB 4125'25, HB 4126'25, HB 4128'25",0,,2025-03-25,"Referred To Second Reading",https://legiscan.com/MI/bill/HB4124/2025,https://legislature.mi.gov/Bills/Bill?ObjectName=2025-HB-4124
1983379,2183,HB4125,1,Introduced,2025-02-25,"Higher education: education programs; nuclear and hydrogen education grant program; create. Creates new act. TIE BAR WITH: HB 4127'25, HB 4129'25, HB 4126'25, HB 4128'25, HB 4124'25","Higher education: education programs; nuclear and hydrogen education grant program; create. Creates new act. TIE BAR WITH: HB 4127'25, HB 4129'25, HB 4126'25, HB 4128'25, HB 4124'25",0,,2025-04-17,"Referred To Second Reading",https://legiscan.com/MI/bill/HB4125/2025,https://legislature.mi.gov/Bills/Bill?ObjectName=2025-HB-4125
1983217,2183,HB4126,1,Introduced,2025-02-25,"Higher education: education programs; fund for nuclear and hydrogen education grant program; create. Creates new act. TIE BAR WITH: HB 4127'25, HB 4129'25, HB 4125'25, HB 4128'25, HB 4124'25","Higher education: education programs; fund for nuclear and hydrogen education grant program; create. Creates new act. TIE BAR WITH: HB 4127'25, HB 4129'25, HB 4125'25, HB 4128'25, HB 4124'25",0,,2025-03-25,"Referred To Second Reading",https://legiscan.com/MI/bill/HB4126/2025,https://legislature.mi.gov/Bills/Bill?ObjectName=2025-HB-4126
1983091,2183,HB4127,1,Introduced,2025-02-25,"Energy: nuclear; definition of advanced nuclear reactors; provide for. Amends sec. 10h of 1939 PA 3 (MCL 460.10h). TIE BAR WITH: HB 4129'25, HB 4125'25, HB 4126'25, HB 4128'25, HB 4124'25","Energy: nuclear; definition of advanced nuclear reactors; provide for. Amends sec. 10h of 1939 PA 3 (MCL 460.10h). TIE BAR WITH: HB 4129'25, HB 4125'25, HB 4126'25, HB 4128'25, HB 4124'25",0,,2025-03-25,"Referred To Second Reading",https://legiscan.com/MI/bill/HB4127/2025,https://legislature.mi.gov/Bills/Bill?ObjectName=2025-HB-4127
1982810,2183,HB4128,1,Introduced,2025-02-25,"Corporate income tax: credits; credit for advanced small modular reactor generated power; provide for. Amends 1967 PA 281 (MCL 206.1 - 206.847) by adding sec. 678. TIE BAR WITH: HB 4127'25, HB 4129'25, HB 4125'25, HB 4126'25, HB 4124'25","Corporate income tax: credits; credit for advanced small modular reactor generated power; provide for. Amends 1967 PA 281 (MCL 206.1 - 206.847) by adding sec. 678. TIE BAR WITH: HB 4127'25, HB 4129'25, HB 4125'25, HB 4126'25, HB 4124'25",0,,2025-03-25,"Referred To Second Reading",https://legiscan.com/MI/bill/HB4128/2025,https://legislature.mi.gov/Bills/Bill?ObjectName=2025-HB-4128
1983028,2183,HB4129,1,Introduced,2025-02-25,"Labor: employment incentives; employment incentives nuclear and hydrogen graduate attraction and retention program act; create. Creates new act. TIE BAR WITH: HB 4127'25, HB 4125'25, HB 4126'25, HB 4128'25, HB 4124'25","Labor: employment incentives; employment incentives nuclear and hydrogen graduate attraction and retention program act; create. Creates new act. TIE BAR WITH: HB 4127'25, HB 4125'25, HB 4126'25, HB 4128'25, HB 4124'25",0,,2025-04-17,"Referred To Second Reading",https://legiscan.com/MI/bill/HB4129/2025,https://legislature.mi.gov/Bills/Bill?ObjectName=2025-HB-4129
1986101,2183,HB4130,1,Introduced,2025-02-26,"Crimes: animals; cross-reference in animal welfare fund act; update. Amends sec. 2 of 2007 PA 132 (MCL 287.992). TIE BAR WITH: HB 4131'25","Crimes: animals; cross-reference in animal welfare fund act; update. Amends sec. 2 of 2007 PA 132 (MCL 287.992). TIE BAR WITH: HB 4131'25",821,"House Judiciary",2025-03-04,"Bill Electronically Reproduced 02/26/2025",https://legiscan.com/MI/bill/HB4130/2025,https://legislature.mi.gov/Bills/Bill?ObjectName=2025-HB-4130
1986089,2183,HB4131,1,Introduced,2025-02-26,"Animals: care and treatment; definition of shelter for animals; modify. Amends sec. 50 of 1931 PA 328 (MCL 750.50).","Animals: care and treatment; definition of shelter for animals; modify. Amends sec. 50 of 1931 PA 328 (MCL 750.50).",821,"House Judiciary",2025-03-04,"Bill Electronically Reproduced 02/26/2025",https://legiscan.com/MI/bill/HB4131/2025,https://legislature.mi.gov/Bills/Bill?ObjectName=2025-HB-4131
1986184,2183,HB4132,1,Introduced,2025-02-26,"Crimes: animals; cross-reference in revised judicature act; update. Amends sec. 2950 of 1961 PA 236 (MCL 600.2950). TIE BAR WITH: HB 4131'25","Crimes: animals; cross-reference in revised judicature act; update. Amends sec. 2950 of 1961 PA 236 (MCL 600.2950). TIE BAR WITH: HB 4131'25",821,"House Judiciary",2025-03-04,"Bill Electronically Reproduced 02/27/2025",https://legiscan.com/MI/bill/HB4132/2025,https://legislature.mi.gov/Bills/Bill?ObjectName=2025-HB-4132
1985916,2183,HB4133,1,Introduced,2025-02-26,"Crimes: other; preventing access to a health care facility; prohibit. Creates new act.","Crimes: other; preventing access to a health care facility; prohibit. Creates new act.",899,"House Government Operations",2025-03-04,"Bill Electronically Reproduced 02/26/2025",https://legiscan.com/MI/bill/HB4133/2025,https://legislature.mi.gov/Bills/Bill?ObjectName=2025-HB-4133
1985903,2183,HB4134,1,Introduced,2025-02-26,"Criminal procedure: sentencing guidelines; sentencing guidelines for certain crimes related to preventing access to a health care facility; enact. Amends sec. 13n, ch. XVII of 1927 PA 175 (MCL 777.13n). TIE BAR WITH: HB 4133'25","Criminal procedure: sentencing guidelines; sentencing guidelines for certain crimes related to preventing access to a health care facility; enact. Amends sec. 13n, ch. XVII of 1927 PA 175 (MCL 777.13n). TIE BAR WITH: HB 4133'25",899,"House Government Operations",2025-03-04,"Bill Electronically Reproduced 02/26/2025",https://legiscan.com/MI/bill/HB4134/2025,https://legislature.mi.gov/Bills/Bill?ObjectName=2025-HB-4134
1986235,2183,HB4135,2,Engrossed,2025-06-05,"Property: conveyance of state property; conveyance of certain state-owned property in Jackson County; provide for. Creates land transfer act.","Property: conveyance of state property; conveyance of certain state-owned property in Jackson County; provide for. Creates land transfer act.",3189,"Senate Local Government",2025-06-10,"Referred To Committee On Local Government",https://legiscan.com/MI/bill/HB4135/2025,https://legislature.mi.gov/Bills/Bill?ObjectName=2025-HB-4135
1986197,2183,HB4136,2,Engrossed,2025-05-06,"Elections: registration; department of natural resources and those designated by the department of natural resources to issue a resident hunting, fishing, or fur harvester's license to provide voter registration applications to resident hunting, fishing, or fur harvester's licens Amends 1994 PA 451 (MCL 324.101 - 324.90106) by adding sec. 43540g.","Elections: registration; department of natural resources and those designated by the department of natural resources to issue a resident hunting, fishing, or fur harvester's license to provide voter registration applications to resident hunting, fishing, or fur harvester's licens Amends 1994 PA 451 (MCL 324.101 - 324.90106) by adding sec. 43540g.",4745,"Senate Elections And Ethics",2025-05-13,"Referred To Committee On Elections And Ethics",https://legiscan.com/MI/bill/HB4136/2025,https://legislature.mi.gov/Bills/Bill?ObjectName=2025-HB-4136
1986074,2183,HB4137,1,Introduced,2025-02-26,"Traffic control: speed restrictions; determination in accordance with traffic engineering practices; modify. Amends sec. 628 of 1949 PA 300 (MCL 257.628).","Traffic control: speed restrictions; determination in accordance with traffic engineering practices; modify. Amends sec. 628 of 1949 PA 300 (MCL 257.628).",2834,"House Transportation And Infrastructure",2025-03-04,"Bill Electronically Reproduced 02/26/2025",https://legiscan.com/MI/bill/HB4137/2025,https://legislature.mi.gov/Bills/Bill?ObjectName=2025-HB-4137
1986127,2183,HB4138,1,Introduced,2025-02-26,"Civil procedure: service of process; provisions relating to service of process and court fees; amend to reflect repeal of the extreme risk protection order act. Amends secs. 1908, 2529 & 2559 of 1961 PA 236 (MCL 600.1908 et seq.).","Civil procedure: service of process; provisions relating to service of process and court fees; amend to reflect repeal of the extreme risk protection order act. Amends secs. 1908, 2529 & 2559 of 1961 PA 236 (MCL 600.1908 et seq.).",821,"House Judiciary",2025-03-04,"Bill Electronically Reproduced 02/26/2025",https://legiscan.com/MI/bill/HB4138/2025,https://legislature.mi.gov/Bills/Bill?ObjectName=2025-HB-4138
1985928,2183,HB4139,1,Introduced,2025-02-26,"Weapons: firearms; firearms law; amend to reflect repeal of the extreme risk protection order act. Amends secs. 2, 2b, 5b & 8 of 1927 PA 372 (MCL 28.422 et seq.). TIE BAR WITH: HB 4140'25, HB 4140'25","Weapons: firearms; firearms law; amend to reflect repeal of the extreme risk protection order act. Amends secs. 2, 2b, 5b & 8 of 1927 PA 372 (MCL 28.422 et seq.). TIE BAR WITH: HB 4140'25, HB 4140'25",821,"House Judiciary",2025-03-04,"Bill Electronically Reproduced 02/26/2025",https://legiscan.com/MI/bill/HB4139/2025,https://legislature.mi.gov/Bills/Bill?ObjectName=2025-HB-4139
1986210,2183,HB4140,1,Introduced,2025-02-26,"Civil procedure: injunctions; extreme risk protection order act; repeal. Repeals 2023 PA 38 (MCL 691.1801 - 691.1821). TIE BAR WITH: HB 4138'25, HB 4139'25","Civil procedure: injunctions; extreme risk protection order act; repeal. Repeals 2023 PA 38 (MCL 691.1801 - 691.1821). TIE BAR WITH: HB 4138'25, HB 4139'25",821,"House Judiciary",2025-03-04,"Bill Electronically Reproduced 02/26/2025",https://legiscan.com/MI/bill/HB4140/2025,https://legislature.mi.gov/Bills/Bill?ObjectName=2025-HB-4140
1985850,2183,HB4141,1,Introduced,2025-02-26,"Education: students; a wireless communications device policy: require the board of a school district or board of directors of a public school academy to implement. Amends 1976 PA 451 (MCL 380.1 - 380.1852) by adding sec. 1303a & repeals sec. 1303 of 1976 PA 451 (MCL 380.1303).","Education: students; a wireless communications device policy: require the board of a school district or board of directors of a public school academy to implement. Amends 1976 PA 451 (MCL 380.1 - 380.1852) by adding sec. 1303a & repeals sec. 1303 of 1976 PA 451 (MCL 380.1303).",0,,2025-07-24,"Defeated Roll Call #171 Yeas 53 Nays 45 Excused 0 Not Voting 12",https://legiscan.com/MI/bill/HB4141/2025,https://legislature.mi.gov/Bills/Bill?ObjectName=2025-HB-4141
1985981,2183,HB4142,1,Introduced,2025-02-26,"Taxation: other; digital advertising services tax act; create. Creates new act.","Taxation: other; digital advertising services tax act; create. Creates new act.",2834,"House Transportation And Infrastructure",2025-03-04,"Bill Electronically Reproduced 02/26/2025",https://legiscan.com/MI/bill/HB4142/2025,https://legislature.mi.gov/Bills/Bill?ObjectName=2025-HB-4142
1986061,2183,HB4143,1,Introduced,2025-02-26,"Corporate income tax: revenue distribution; earmark to the Michigan transportation fund; provide for. Amends sec. 695 of 1967 PA 281 (MCL 206.695).","Corporate income tax: revenue distribution; earmark to the Michigan transportation fund; provide for. Amends sec. 695 of 1967 PA 281 (MCL 206.695).",2834,"House Transportation And Infrastructure",2025-03-04,"Bill Electronically Reproduced 02/26/2025",https://legiscan.com/MI/bill/HB4143/2025,https://legislature.mi.gov/Bills/Bill?ObjectName=2025-HB-4143
1986114,2183,HB4144,1,Introduced,2025-02-26,"Corporate income tax: rate; rate increase and earmark of increased revenue to school aid fund; provide for. Amends secs. 623 & 695 of 1967 PA 281 (MCL 206.623 & 206.695).","Corporate income tax: rate; rate increase and earmark of increased revenue to school aid fund; provide for. Amends secs. 623 & 695 of 1967 PA 281 (MCL 206.623 & 206.695).",2834,"House Transportation And Infrastructure",2025-03-04,"Bill Electronically Reproduced 02/26/2025",https://legiscan.com/MI/bill/HB4144/2025,https://legislature.mi.gov/Bills/Bill?ObjectName=2025-HB-4144
1985890,2183,HB4145,2,Engrossed,2025-05-20,"Highways: memorial; portion of US-127; designate as the ""2nd Lt. Roosevelt Stiger Memorial Highway"". Amends 2001 PA 142 (MCL 250.1001 - 250.2092) by adding sec. 46a.","Highways: memorial; portion of US-127; designate as the ""2nd Lt. Roosevelt Stiger Memorial Highway"". Amends 2001 PA 142 (MCL 250.1001 - 250.2092) by adding sec. 46a.",4863,"Senate Veterans And Emergency Services",2025-05-29,"Referred To Committee On Veterans And Emergency Services",https://legiscan.com/MI/bill/HB4145/2025,https://legislature.mi.gov/Bills/Bill?ObjectName=2025-HB-4145
1986049,2183,HB4146,1,Introduced,2025-02-26,"Health occupations: psychologists; supervised postgraduate experience requirements; modify. Amends 1978 PA 368 (MCL 333.1101 - 333.25211) by adding sec. 18223a. TIE BAR WITH: HB 4165'25","Health occupations: psychologists; supervised postgraduate experience requirements; modify. Amends 1978 PA 368 (MCL 333.1101 - 333.25211) by adding sec. 18223a. TIE BAR WITH: HB 4165'25",892,"House Health Policy",2025-03-04,"Bill Electronically Reproduced 02/26/2025",https://legiscan.com/MI/bill/HB4146/2025,https://legislature.mi.gov/Bills/Bill?ObjectName=2025-HB-4146
1985995,2183,HB4147,2,Engrossed,2025-03-20,"School aid: other; use of funding for consolidation of administrative and service functions; allow. Amends sec. 11x of 1979 PA 94 (MCL 388.1611x).","School aid: other; use of funding for consolidation of administrative and service functions; allow. Amends sec. 11x of 1979 PA 94 (MCL 388.1611x).",834,"Senate Education",2025-04-15,"Referred To Committee On Education",https://legiscan.com/MI/bill/HB4147/2025,https://legislature.mi.gov/Bills/Bill?ObjectName=2025-HB-4147
1986157,2183,HB4148,1,Introduced,2025-02-26,"Education: board members; state board of education; require members to be selected from districts. Amends sec. 282a of 1954 PA 116 (MCL 168.282a) & adds sec. 282b.","Education: board members; state board of education; require members to be selected from districts. Amends sec. 282a of 1954 PA 116 (MCL 168.282a) & adds sec. 282b.",5081,"House Rules",2025-05-13,"Referred To Committee On Rules",https://legiscan.com/MI/bill/HB4148/2025,https://legislature.mi.gov/Bills/Bill?ObjectName=2025-HB-4148
1986223,2183,HB4149,2,Engrossed,2025-03-20,"Education: school districts; certain information on the school district's, intermediate school district's, or public school academy's website; require a school district, an intermediate school district, or a public school academy to post. Amends 1976 PA 451 (MCL 380.1 - 380.1852) by adding sec. 1280h.","Education: school districts; certain information on the school district's, intermediate school district's, or public school academy's website; require a school district, an intermediate school district, or a public school academy to post. Amends 1976 PA 451 (MCL 380.1 - 380.1852) by adding sec. 1280h.",834,"Senate Education",2025-04-15,"Referred To Committee On Education",https://legiscan.com/MI/bill/HB4149/2025,https://legislature.mi.gov/Bills/Bill?ObjectName=2025-HB-4149
1985837,2183,HB4150,2,Engrossed,2025-03-12,"Education: other; fees for evaluation of applications; eliminate. Amends secs. 1531h & 1538 of 1976 PA 451 (MCL 380.1531h & 380.1538).","Education: other; fees for evaluation of applications; eliminate. Amends secs. 1531h & 1538 of 1976 PA 451 (MCL 380.1531h & 380.1538).",834,"Senate Education",2025-03-18,"Referred To Committee On Education",https://legiscan.com/MI/bill/HB4150/2025,https://legislature.mi.gov/Bills/Bill?ObjectName=2025-HB-4150
1986022,2183,HB4151,2,Engrossed,2025-03-12,"Education: teachers and administrators; endorsement requirements; modify. Amends sec. 1531 of 1976 PA 451 (MCL 380.1531).","Education: teachers and administrators; endorsement requirements; modify. Amends sec. 1531 of 1976 PA 451 (MCL 380.1531).",834,"Senate Education",2025-03-18,"Referred To Committee On Education",https://legiscan.com/MI/bill/HB4151/2025,https://legislature.mi.gov/Bills/Bill?ObjectName=2025-HB-4151
1986171,2183,HB4152,1,Introduced,2025-02-26,"Education: other; certain requirements for the approval of teacher preparation institutions; create. Amends sec. 1531e of 1976 PA 451 (MCL 380.1531e).","Education: other; certain requirements for the approval of teacher preparation institutions; create. Amends sec. 1531e of 1976 PA 451 (MCL 380.1531e).",5081,"House Rules",2025-05-13,"Referred To Committee On Rules",https://legiscan.com/MI/bill/HB4152/2025,https://legislature.mi.gov/Bills/Bill?ObjectName=2025-HB-4152
1985956,2183,HB4153,2,Engrossed,2025-03-12,"Education: teachers and administrators; district-level certifications; provide for. Amends secs. 501, 521, 551, 1231, 1233, 1311b, 1526, 1535a & 1809 of 1976 PA 451 (MCL 380.501 et seq.) & adds sec. 1531l.","Education: teachers and administrators; district-level certifications; provide for. Amends secs. 501, 521, 551, 1231, 1233, 1311b, 1526, 1535a & 1809 of 1976 PA 451 (MCL 380.501 et seq.) & adds sec. 1531l.",834,"Senate Education",2025-03-18,"Referred To Committee On Education",https://legiscan.com/MI/bill/HB4153/2025,https://legislature.mi.gov/Bills/Bill?ObjectName=2025-HB-4153
1985864,2183,HB4154,2,Engrossed,2025-03-20,"Education: career and technical; trade schools; include in the postsecondary enrollment options act. Amends sec. 3 of 1996 PA 160 (MCL 388.513).","Education: career and technical; trade schools; include in the postsecondary enrollment options act. Amends sec. 3 of 1996 PA 160 (MCL 388.513).",834,"Senate Education",2025-04-15,"Referred To Committee On Education",https://legiscan.com/MI/bill/HB4154/2025,https://legislature.mi.gov/Bills/Bill?ObjectName=2025-HB-4154
1985824,2183,HB4155,1,Introduced,2025-02-26,"Education: curriculum; recommendations for curriculum companies and assessment companies; require the department to provide. Amends 1976 PA 451 (MCL 380.1 - 380.1852) by adding sec. 1278e.","Education: curriculum; recommendations for curriculum companies and assessment companies; require the department to provide. Amends 1976 PA 451 (MCL 380.1 - 380.1852) by adding sec. 1278e.",5081,"House Rules",2025-05-13,"Referred To Committee On Rules",https://legiscan.com/MI/bill/HB4155/2025,https://legislature.mi.gov/Bills/Bill?ObjectName=2025-HB-4155
1986036,2183,HB4156,2,Engrossed,2025-04-17,"Education: curriculum; merit curriculum; modify. Amends secs. 1278a & 1278b of 1976 PA 451 (MCL 380.1278a & 380.1278b) & adds sec. 1278e.","Education: curriculum; merit curriculum; modify. Amends secs. 1278a & 1278b of 1976 PA 451 (MCL 380.1278a & 380.1278b) & adds sec. 1278e.",834,"Senate Education",2025-04-22,"Referred To Committee On Education",https://legiscan.com/MI/bill/HB4156/2025,https://legislature.mi.gov/Bills/Bill?ObjectName=2025-HB-4156
1985798,2183,HB4157,2,Engrossed,2025-04-17,"Education: examinations; pilot programs for a state-administered assessment system; create. Amends secs. 11, 104, 104b & 104c of 1979 PA 94 (MCL 388.1611 et seq.) & adds sec. 104d. TIE BAR WITH: HB 4158'25","Education: examinations; pilot programs for a state-administered assessment system; create. Amends secs. 11, 104, 104b & 104c of 1979 PA 94 (MCL 388.1611 et seq.) & adds sec. 104d. TIE BAR WITH: HB 4158'25",834,"Senate Education",2025-04-22,"Referred To Committee On Education",https://legiscan.com/MI/bill/HB4157/2025,https://legislature.mi.gov/Bills/Bill?ObjectName=2025-HB-4157
1986141,2183,HB4158,2,Engrossed,2025-04-17,"Education: examinations; references to M-STEP to include a state-administered assessment system under section 104d of the state school aid act of 1979; modify. Amends secs. 502, 503, 522, 552 & 1279g of 1976 PA 451 (MCL 380.502 et seq.). TIE BAR WITH: HB 4157'25","Education: examinations; references to M-STEP to include a state-administered assessment system under section 104d of the state school aid act of 1979; modify. Amends secs. 502, 503, 522, 552 & 1279g of 1976 PA 451 (MCL 380.502 et seq.). TIE BAR WITH: HB 4157'25",834,"Senate Education",2025-04-22,"Referred To Committee On Education",https://legiscan.com/MI/bill/HB4158/2025,https://legislature.mi.gov/Bills/Bill?ObjectName=2025-HB-4158
1986010,2183,HB4159,2,Engrossed,2025-04-17,"Education: curriculum; core academic curriculum requirements; modify. Amends sec. 1278 of 1976 PA 451 (MCL 380.1278).","Education: curriculum; core academic curriculum requirements; modify. Amends sec. 1278 of 1976 PA 451 (MCL 380.1278).",834,"Senate Education",2025-04-22,"Referred To Committee On Education",https://legiscan.com/MI/bill/HB4159/2025,https://legislature.mi.gov/Bills/Bill?ObjectName=2025-HB-4159
1985876,2183,HB4160,1,Introduced,2025-02-26,"Administrative procedure: rules; adoption of rules by state agencies more stringent than federal regulations; prohibit. Amends secs. 32 & 45 of 1969 PA 306 (MCL 24.232 & 24.245).","Administrative procedure: rules; adoption of rules by state agencies more stringent than federal regulations; prohibit. Amends secs. 32 & 45 of 1969 PA 306 (MCL 24.232 & 24.245).",5081,"House Rules",2025-03-04,"Bill Electronically Reproduced 02/26/2025",https://legiscan.com/MI/bill/HB4160/2025,https://legislature.mi.gov/Bills/Bill?ObjectName=2025-HB-4160
1985943,2183,HB4161,2,Engrossed,2025-03-06,"Appropriations: omnibus; appropriations for multiple departments and branches for fiscal year 2025-2026; provide for. Creates appropriation act.","Appropriations: omnibus; appropriations for multiple departments and branches for fiscal year 2025-2026; provide for. Creates appropriation act.",829,"Senate Appropriations",2025-03-12,"Referred To Committee On Appropriations",https://legiscan.com/MI/bill/HB4161/2025,https://legislature.mi.gov/Bills/Bill?ObjectName=2025-HB-4161
1985968,2183,HB4162,2,Engrossed,2025-03-06,"Appropriations: school aid; appropriations for K-12 school aid; provide for. Amends secs. 11 & 17b of 1979 PA 94 (MCL 388.1611 & 388.1617b).","Appropriations: school aid; appropriations for K-12 school aid; provide for. Amends secs. 11 & 17b of 1979 PA 94 (MCL 388.1611 & 388.1617b).",829,"Senate Appropriations",2025-03-12,"Referred To Committee On Appropriations",https://legiscan.com/MI/bill/HB4162/2025,https://legislature.mi.gov/Bills/Bill?ObjectName=2025-HB-4162
1990964,2183,HB4163,1,Introduced,2025-03-04,"Military affairs: other; release of the Michigan national guard into active duty combat without an official act of Congress; prohibit. Amends 1967 PA 150 (MCL 32.501 - 32.851) by adding sec. 203. TIE BAR WITH: HB 4164'25","Military affairs: other; release of the Michigan national guard into active duty combat without an official act of Congress; prohibit. Amends 1967 PA 150 (MCL 32.501 - 32.851) by adding sec. 203. TIE BAR WITH: HB 4164'25",899,"House Government Operations",2025-03-05,"Bill Electronically Reproduced 03/04/2025",https://legiscan.com/MI/bill/HB4163/2025,https://legislature.mi.gov/Bills/Bill?ObjectName=2025-HB-4163
1991079,2183,HB4164,1,Introduced,2025-03-04,"Military affairs: other; release of the Michigan National Guard into active duty combat without an official act of Congress; add related definitions. Amends 1967 PA 150 (MCL 32.501 - 32.851) by adding sec. 203a.","Military affairs: other; release of the Michigan National Guard into active duty combat without an official act of Congress; add related definitions. Amends 1967 PA 150 (MCL 32.501 - 32.851) by adding sec. 203a.",899,"House Government Operations",2025-03-05,"Bill Electronically Reproduced 03/04/2025",https://legiscan.com/MI/bill/HB4164/2025,https://legislature.mi.gov/Bills/Bill?ObjectName=2025-HB-4164
1992313,2183,HB4165,1,Introduced,2025-03-05,"Health occupations: psychologists; supervised postgraduate experience requirements; modify. Amends sec. 18223 of 1978 PA 368 (MCL 333.18223).","Health occupations: psychologists; supervised postgraduate experience requirements; modify. Amends sec. 18223 of 1978 PA 368 (MCL 333.18223).",892,"House Health Policy",2025-03-06,"Bill Electronically Reproduced 03/05/2025",https://legiscan.com/MI/bill/HB4165/2025,https://legislature.mi.gov/Bills/Bill?ObjectName=2025-HB-4165
1992132,2183,HB4166,1,Introduced,2025-03-05,"Crimes: drugs; illicit use of xylazine; prohibit, and provide penalties. Amends secs. 7103, 7105, 7106, 7401, 7403, 7403a, 7451, 7453 & 7455 of 1978 PA 368 (MCL 333.7103 et seq.).","Crimes: drugs; illicit use of xylazine; prohibit, and provide penalties. Amends secs. 7103, 7105, 7106, 7401, 7403, 7403a, 7451, 7453 & 7455 of 1978 PA 368 (MCL 333.7103 et seq.).",821,"House Judiciary",2025-03-06,"Bill Electronically Reproduced 03/05/2025",https://legiscan.com/MI/bill/HB4166/2025,https://legislature.mi.gov/Bills/Bill?ObjectName=2025-HB-4166
1992595,2183,HB4167,1,Introduced,2025-03-05,"Criminal procedure: sentencing guidelines; sentencing guidelines for illicit use of xylazine; provide for. Amends sec. 13m, ch. XVII of 1927 PA 175 (MCL 777.13m).","Criminal procedure: sentencing guidelines; sentencing guidelines for illicit use of xylazine; provide for. Amends sec. 13m, ch. XVII of 1927 PA 175 (MCL 777.13m).",821,"House Judiciary",2025-03-06,"Bill Electronically Reproduced 03/05/2025",https://legiscan.com/MI/bill/HB4167/2025,https://legislature.mi.gov/Bills/Bill?ObjectName=2025-HB-4167
1992220,2183,HB4168,1,Introduced,2025-03-05,"Labor: hours and wages; employer offset of wages due an employee in a pay period based on the amount of gratuities the employee receives; prohibit. Amends sec. 4d of 2018 PA 337 (MCL 408.934d).","Labor: hours and wages; employer offset of wages due an employee in a pay period based on the amount of gratuities the employee receives; prohibit. Amends sec. 4d of 2018 PA 337 (MCL 408.934d).",5089,"House Economic Competitiveness",2025-03-06,"Bill Electronically Reproduced 03/05/2025",https://legiscan.com/MI/bill/HB4168/2025,https://legislature.mi.gov/Bills/Bill?ObjectName=2025-HB-4168
1992178,2183,HB4169,1,Introduced,2025-03-05,"Health: diseases; rare disease advisory council; create. Amends 1978 PA 368 (MCL 333.1101 - 333.25211) by adding secs. 5135 & 5135a.","Health: diseases; rare disease advisory council; create. Amends 1978 PA 368 (MCL 333.1101 - 333.25211) by adding secs. 5135 & 5135a.",892,"House Health Policy",2025-03-06,"Bill Electronically Reproduced 03/05/2025",https://legiscan.com/MI/bill/HB4169/2025,https://legislature.mi.gov/Bills/Bill?ObjectName=2025-HB-4169
1992501,2183,HB4170,2,Engrossed,2025-03-18,"Individual income tax: rate; rollback of rate to 4.05% and effect of a triggering rate reduction; provide for, and clarify permanency. Amends sec. 51 of 1967 PA 281 (MCL 206.51).","Individual income tax: rate; rollback of rate to 4.05% and effect of a triggering rate reduction; provide for, and clarify permanency. Amends sec. 51 of 1967 PA 281 (MCL 206.51).",4717,"Senate Finance, Insurance, And Consumer Protection",2025-03-20,"Referred To Committee On Finance, Insurance, And Consumer Protection",https://legiscan.com/MI/bill/HB4170/2025,https://legislature.mi.gov/Bills/Bill?ObjectName=2025-HB-4170
1992545,2183,HB4171,1,Introduced,2025-03-05,"Appropriations: supplemental; funding to test for avian influenza (H5N1) in hospital settings; provide for. Creates appropriation act.","Appropriations: supplemental; funding to test for avian influenza (H5N1) in hospital settings; provide for. Creates appropriation act.",889,"House Appropriations",2025-03-06,"Bill Electronically Reproduced 03/05/2025",https://legiscan.com/MI/bill/HB4171/2025,https://legislature.mi.gov/Bills/Bill?ObjectName=2025-HB-4171
1991997,2183,HB4172,1,Introduced,2025-03-05,"Appropriations: supplemental; funding for bird flu testing; provide for. Creates appropriation act.","Appropriations: supplemental; funding for bird flu testing; provide for. Creates appropriation act.",889,"House Appropriations",2025-03-06,"Bill Electronically Reproduced 03/05/2025",https://legiscan.com/MI/bill/HB4172/2025,https://legislature.mi.gov/Bills/Bill?ObjectName=2025-HB-4172
1992265,2183,HB4173,1,Introduced,2025-03-05,"Appropriations: supplemental; funding to test facilities and backyard flocks for bird flu (H5N1); provide for. Creates appropriation act.","Appropriations: supplemental; funding to test facilities and backyard flocks for bird flu (H5N1); provide for. Creates appropriation act.",889,"House Appropriations",2025-03-06,"Bill Electronically Reproduced 03/05/2025",https://legiscan.com/MI/bill/HB4173/2025,https://legislature.mi.gov/Bills/Bill?ObjectName=2025-HB-4173
1993692,2183,HB4174,1,Introduced,2025-03-06,"Juveniles: other; presumption of admissibility for a juvenile's self-incriminating responses obtained through deceptive police practices; modify. Amends sec. 1, ch. XIIA of 1939 PA 288 (MCL 712A.1) & adds sec. 17e to ch. XIIA.","Juveniles: other; presumption of admissibility for a juvenile's self-incriminating responses obtained through deceptive police practices; modify. Amends sec. 1, ch. XIIA of 1939 PA 288 (MCL 712A.1) & adds sec. 17e to ch. XIIA.",821,"House Judiciary",2025-03-11,"Bill Electronically Reproduced 03/06/2025",https://legiscan.com/MI/bill/HB4174/2025,https://legislature.mi.gov/Bills/Bill?ObjectName=2025-HB-4174
